mercado;categoria;produto;preco;produto_nos_dois
Atakarejo;Biscoitos e Salgadinhos;Biscoito Recheado Doce de Leite Bono Nestle 90g;R$ 3,39;Sim
Atakarejo;Biscoitos e Salgadinhos;Biscoito Recheado Escureto Richester 35,6g;R$ 1,28;Sim
Atakarejo;Biscoitos e Salgadinhos;Biscoito Recheado Escureto Sabor Baunilha Richester 80g;R$ 2,09;Não
Atakarejo;Biscoitos e Salgadinhos;Biscoito Recheado Goiabinha Bauducco 112g;R$ 4,28;Sim
Atakarejo;Biscoitos e Salgadinhos;Biscoito Recheado Milkshake de Morango Oreo 90g;R$ 3,55;Não
Atakarejo;Biscoitos e Salgadinhos;Biscoito Recheado Mini Oreo 35g;R$ 2,85;Sim
Atakarejo;Biscoitos e Salgadinhos;Biscoito Recheado Original Oreo 144g;R$ 6,90;Sim
Atakarejo;Biscoitos e Salgadinhos;Biscoito Recheado Richester Floresta Negra Amori 125g;R$ 2,75;Não
Atakarejo;Biscoitos e Salgadinhos;Biscoito Recheado Sabor Chocolate com Morango Treloso Vitarella 120g;R$ 1,69;Sim
Atakarejo;Biscoitos e Salgadinhos;Biscoito Recheado Sabor Chocolate com Morango Treloso Vitarella 480g;R$ 7,78;Não
Atakarejo;Biscoitos e Salgadinhos;Biscoito Recheado Sabor Creme Gameleira 750g;R$ 11,30;Não
Atakarejo;Biscoitos e Salgadinhos;Biscoito Recheado Sabor Flocos Richester Amori 125g;R$ 2,75;Não
Atakarejo;Biscoitos e Salgadinhos;Biscoito Recheado Sabor Flocos Vitarella 120g;R$ 1,69;Sim
Atakarejo;Biscoitos e Salgadinhos;Biscoito Recheado Sabor Limão Piraquê 76g;R$ 2,75;Sim
Atakarejo;Biscoitos e Salgadinhos;Biscoito Recheado Sabor de Chocolate Piraquê 76g;R$ 2,75;Sim
Atakarejo;Biscoitos e Salgadinhos;Biscoito Recheado Treloso Sabor Morango 222gr Vitarella 6un Leve Mais por Menos;R$ 5,18;Não
Atakarejo;Biscoitos e Salgadinhos;Biscoito Recheado Tub In Morango Montevergine Embalagem 48g;R$ 2,49;Sim
Atakarejo;Biscoitos e Salgadinhos;Biscoito Recheado Tutti Frutti Bubbaloo Trakinas 126g;R$ 3,36;Não
Atakarejo;Biscoitos e Salgadinhos;Biscoito Recheado com Morango Amori Richester 35,6g;R$ 1,28;Sim
Atakarejo;Biscoitos e Salgadinhos;Biscoito Recheado de Brigadeiro Treloso Vitarella 120g;R$ 1,69;Sim
Atakarejo;Biscoitos e Salgadinhos;Biscoito Recheado de Chocolate Passatempo 130g;R$ 4,15;Sim
Atakarejo;Biscoitos e Salgadinhos;Biscoito Recheado de Chocolate Treloso Vitarella 74g;R$ 1,90;Não
Atakarejo;Biscoitos e Salgadinhos;Biscoito Recheado de Morango Passatempo 130g;R$ 4,15;Sim
Atakarejo;Biscoitos e Salgadinhos;Biscoito Recheado de Morango Trakinas 126 g;R$ 3,36;Não
Atakarejo;Biscoitos e Salgadinhos;Biscoito Recheio Bem-Casado Treloso Vitarella 120g;R$ 1,69;Sim
Atakarejo;Biscoitos e Salgadinhos;Biscoito Recheio Chocolate Marilan Pit Stop 98g com 4un;R$ 3,68;Sim
Atakarejo;Biscoitos e Salgadinhos;Biscoito Recheio Chocolate Negresco 90g;R$ 3,39;Sim
Atakarejo;Biscoitos e Salgadinhos;Biscoito Recheio Flocos Treloso Vitarella 120g Pacote com 4un;R$ 7,78;Não
Atakarejo;Biscoitos e Salgadinhos;Biscoito Recheio Sabor Morango Bono 90g;R$ 3,39;Sim
Atakarejo;Biscoitos e Salgadinhos;Biscoito Recheio Supreme Chocolate com Creme de Avelã Piraquê 80g;R$ 3,78;Sim
Atakarejo;Biscoitos e Salgadinhos;Biscoito Recheio de Morango Richester Amori 125g;R$ 2,75;Sim
Atakarejo;Biscoitos e Salgadinhos;Biscoito Recheio de Morango Treloso Vitarella 74g;R$ 1,90;Não
Atakarejo;Biscoitos e Salgadinhos;Biscoito Richester Tortinha Amori Limao 140g;R$ 4,06;Não
Atakarejo;Biscoitos e Salgadinhos;Biscoito Rosquinha Sabor Leite Fortaleza 350g;R$ 5,59;Não
Atakarejo;Biscoitos e Salgadinhos;Biscoito Rosquinha Tradicional Chocolate Marilan 300g;R$ 5,88;Sim
Atakarejo;Biscoitos e Salgadinhos;Biscoito Rosquinha de Chocolate Petyan 300g;R$ 3,98;Não
Atakarejo;Biscoitos e Salgadinhos;Biscoito Rosquinha de Coco Petyan Un 300g;R$ 4,50;Não
Atakarejo;Biscoitos e Salgadinhos;Biscoito Rosquinhas de Coco Ekobom 300g;R$ 5,25;Não
Atakarejo;Biscoitos e Salgadinhos;Biscoito Sabor Broa de Milho São Benedito 400g;R$ 7,75;Não
Atakarejo;Biscoitos e Salgadinhos;Biscoito Salgado Club Social Presunto Multipack 141g;R$ 5,84;Sim
Atakarejo;Biscoitos e Salgadinhos;Biscoito Salgado Delicitá Queijo 138g;R$ 5,19;Sim
Atakarejo;Biscoitos e Salgadinhos;Biscoito Salgado Integral Delicita Vitarella 138g;R$ 5,19;Não
Atakarejo;Biscoitos e Salgadinhos;Biscoito Salgado Pit Stop Sabor Presunto Marilan 137g;R$ 3,68;Não
Atakarejo;Biscoitos e Salgadinhos;Biscoito Salgado Queijinho Piraquê 100g;R$ 4,92;Não
Atakarejo;Biscoitos e Salgadinhos;Biscoito Salgado Salt Plus Com Gergelim Brandini 360g;R$ 6,15;Não
Atakarejo;Biscoitos e Salgadinhos;Biscoito Supreme Cheesecake com Geleia de Frutas Vermelhas Piraquê 80g;R$ 3,78;Não
Atakarejo;Biscoitos e Salgadinhos;Biscoito Supreme Chocolate Branco E Geleia de Limão Siciliano Piraquê 80g;R$ 3,78;Sim
Atakarejo;Biscoitos e Salgadinhos;Biscoito Teens Chocolate 80g;R$ 3,74;Não
Atakarejo;Biscoitos e Salgadinhos;Biscoito Tortinha Sabor Chocolate Marilan 140g;R$ 5,59;Sim
Atakarejo;Biscoitos e Salgadinhos;Biscoito Tortinhas de Chocolate Vitarella 140g;R$ 2,55;Sim
Atakarejo;Biscoitos e Salgadinhos;Biscoito Tortinhas de Limão Vitarella 140g;R$ 2,55;Sim
Atakarejo;Biscoitos e Salgadinhos;Biscoito Trakinas Chocolate 126g;R$ 3,36;Sim
Atakarejo;Biscoitos e Salgadinhos;Biscoito Treloso Recheado Sabor Brigadeiro Vitarella 480g;R$ 7,78;Não
Atakarejo;Biscoitos e Salgadinhos;Biscoito Wafer Chocoresco Treloso Vitarella 35g;R$ 0,99;Não
Atakarejo;Biscoitos e Salgadinhos;Biscoito Wafer Limão Marilan 80g;R$ 1,79;Sim
Atakarejo;Biscoitos e Salgadinhos;Biscoito Wafer Limão Rancheiro Pacote 78g;R$ 1,96;Sim
Atakarejo;Biscoitos e Salgadinhos;Biscoito Wafer Morango Rancheiro 78g;R$ 1,96;Sim
Atakarejo;Biscoitos e Salgadinhos;Biscoito Wafer Oblea Bon o Bon Arcor 30g;R$ 3,08;Não
Atakarejo;Biscoitos e Salgadinhos;Biscoito Wafer Rancheiro Baunilha 78g;R$ 1,96;Sim
Atakarejo;Biscoitos e Salgadinhos;Biscoito Wafer Recheado de Trufas Tub-In Montevergine 54g;R$ 2,49;Não
Atakarejo;Biscoitos e Salgadinhos;Biscoito Wafer Recheio de Morango Piraquê 100g;R$ 3,39;Não
Atakarejo;Biscoitos e Salgadinhos;Biscoito Wafer Sabor Brigadeiro Bauducco 70g;R$ 1,78;Sim
Atakarejo;Biscoitos e Salgadinhos;Biscoito Wafer Sabor Brigadeiro Vitarella 80g;R$ 1,12;Sim
Atakarejo;Biscoitos e Salgadinhos;Biscoito Wafer Sabor Chocolate Vitarella 80g;R$ 1,12;Não
Atakarejo;Biscoitos e Salgadinhos;Biscoito Wafer Sabor Limão Bauducco 70g;R$ 1,78;Não
Atakarejo;Biscoitos e Salgadinhos;Biscoito Wafer Sabor Limão Vitarella 80g;R$ 1,12;Sim
Atakarejo;Biscoitos e Salgadinhos;Biscoito Wafer Sabor Morango Bauducco 70g;R$ 1,78;Sim
Atakarejo;Biscoitos e Salgadinhos;Biscoito Wafer Sabor Morango Richester Amori 80g;R$ 2,09;Não
Atakarejo;Biscoitos e Salgadinhos;Biscoito Wafer Sabor Morango Vitarella 80g;R$ 1,12;Sim
Atakarejo;Biscoitos e Salgadinhos;Biscoito Wafer Sabor Mousse de Limão Richester Amori 80g;R$ 2,09;Não
Atakarejo;Biscoitos e Salgadinhos;Biscoito Wafer com Recheio de Chocolate Amori Richester 80g;R$ 2,09;Não
Atakarejo;Biscoitos e Salgadinhos;Biscoito Wafer com Recheio de Chocolate Bauducco 70g;R$ 1,78;Sim
Atakarejo;Biscoitos e Salgadinhos;Biscoito Wafer de Brigadeiro Treloso Vitarella 35g;R$ 0,99;Não
Atakarejo;Biscoitos e Salgadinhos;Biscoito Wafer de Chocolate Treloso Vitarella 35g;R$ 0,99;Sim
Atakarejo;Biscoitos e Salgadinhos;Biscoito Wafer de Morango Treloso Vitarella 35g;R$ 0,99;Sim
Atakarejo;Biscoitos e Salgadinhos;Biscoito Waffer de Chocolate Rancheiro 78g;R$ 1,96;Sim
Atakarejo;Biscoitos e Salgadinhos;Biscoito com Recheio Sabor Morango Treloso Vitarella 120g;R$ 1,69;Sim
Atakarejo;Biscoitos e Salgadinhos;Biscoito com Recheio de Chocolate Treloso Vitarella 37g;R$ 1,18;Não
Atakarejo;Biscoitos e Salgadinhos;Biscoito de Cebola com Sour Cream Club Social 141g;R$ 4,68;Não
Atakarejo;Biscoitos e Salgadinhos;Biscoito de Chocolate Bauducco 335g;R$ 8,75;Sim
Atakarejo;Biscoitos e Salgadinhos;Biscoito de Chocolate Recheado de Baunilha Escureto Richester 125g;R$ 2,39;Sim
Atakarejo;Biscoitos e Salgadinhos;Biscoito de Chocolate Recheio Baunilha Negresco 90g;R$ 3,39;Sim
Atakarejo;Biscoitos e Salgadinhos;Biscoito de Chocolate Recheio Chocolate Treloso Vitarella 120g;R$ 1,69;Sim
Atakarejo;Biscoitos e Salgadinhos;Biscoito de Chocolate Turma do Treloso Vitarella 100g;R$ 3,89;Não
Atakarejo;Biscoitos e Salgadinhos;Biscoito de Chocolate com Recheio de Chocolate Richester Amori 125g;R$ 2,75;Sim
Atakarejo;Biscoitos e Salgadinhos;Biscoito de Coco Marilan 350g;R$ 4,98;Sim
Atakarejo;Biscoitos e Salgadinhos;Biscoito de Leite Maria Vitarella 350g;R$ 4,95;Sim
Atakarejo;Biscoitos e Salgadinhos;Biscoito de Leite Marilan 350g;R$ 4,98;Sim
Atakarejo;Biscoitos e Salgadinhos;Biscoito de Leite Passatempo 150g;R$ 3,18;Não
Atakarejo;Biscoitos e Salgadinhos;Biscoito de Leite Richester Animados Zoo Cobertura Sabor Chocolate com 40g;R$ 3,58;Sim
Atakarejo;Biscoitos e Salgadinhos;Biscoito de Leite Turma do Treloso Vitarella 100g;R$ 3,39;Não
Atakarejo;Biscoitos e Salgadinhos;Biscoito de Maizena Sabor Chocolate Fortaleza 350g;R$ 7,49;Sim
Atakarejo;Biscoitos e Salgadinhos;Biscoito de Maizena Sabor Chocolate Marilan 350g;R$ 4,98;Não
Atakarejo;Biscoitos e Salgadinhos;Biscoito de Maizena Sabor Chocolate Vitarella 350g;R$ 4,88;Sim
Atakarejo;Biscoitos e Salgadinhos;Biscoito de Maizena Sabor Leite Vitarella 350g;R$ 4,88;Sim
Atakarejo;Biscoitos e Salgadinhos;Biscoito de Maizena Supradely 400g;R$ 4,50;Não
Atakarejo;Biscoitos e Salgadinhos;Biscoito de Maizena Tradicional Fortaleza 350g;R$ 7,49;Sim
Atakarejo;Biscoitos e Salgadinhos;Biscoito de Manteiga Marilan 350g;R$ 4,98;Sim
Atakarejo;Biscoitos e Salgadinhos;Biscoito de Milho Flor do Vale Embalagem 300 G;R$ 4,49;Não
Atakarejo;Biscoitos e Salgadinhos;Biscoito de Polvilho Vale do Prata Tradicional Embalagem 170g;R$ 13,35;Não
Atakarejo;Biscoitos e Salgadinhos;Biscoito de Polvilho de Queijo Vale do Prata 200g;R$ 13,35;Não
Atakarejo;Biscoitos e Salgadinhos;Biscoito de Rosquinha Fortaleza 300g;R$ 5,59;Não
Atakarejo;Biscoitos e Salgadinhos;Biscoito Água Tradicional Vitarella 350g;R$ 5,09;Sim
Atakarejo;Biscoitos e Salgadinhos;Biscoito Água com Gergelim Piraquê Pacote 215g;R$ 6,49;Sim
Atakarejo;Biscoitos e Salgadinhos;Bolacha com Recheio Sabor Morango Negresco 90g;R$ 3,39;Sim
Atakarejo;Biscoitos e Salgadinhos;Canjica de Milho Okoshi com Sal Marinho Embalagem 50g;R$ 5,15;Não
Atakarejo;Biscoitos e Salgadinhos;Choco Biscuit Meio Amargo Bauducco 80g;R$ 8,48;Sim
Atakarejo;Biscoitos e Salgadinhos;Chocolate Wafer Lacta Sonho de Valsa Pacote 25g;R$ 2,05;Sim
Atakarejo;Biscoitos e Salgadinhos;Chocotrio Nestlé Avelã 90g;R$ 8,75;Não
Atakarejo;Biscoitos e Salgadinhos;Cookie Gotas de Chocolate Nestlé Classic 60g;R$ 3,58;Sim
Atakarejo;Biscoitos e Salgadinhos;Cookies Bauducco Chocolate Embalagem 60g;R$ 3,26;Sim
Atakarejo;Biscoitos e Salgadinhos;Cookies Piraque Chocolate 40g;R$ 2,19;Não
Atakarejo;Biscoitos e Salgadinhos;Cookies Richester Amori Baunilha com Gotas de Chocolate Embalagem 40g;R$ 1,79;Não
Atakarejo;Biscoitos e Salgadinhos;Cookies Richester Amori Chocolate 40g;R$ 1,79;Não
Atakarejo;Biscoitos e Salgadinhos;Cookies de Baunilha com Gotas de Chocolate Vitarella 40g;R$ 1,99;Não
Atakarejo;Biscoitos e Salgadinhos;Cream Cracker Tradicional Pilar 350g;R$ 4,58;Não
Atakarejo;Biscoitos e Salgadinhos;Cream Cracker Vitarella Tostadinha 350g;R$ 3,98;Sim
Atakarejo;Biscoitos e Salgadinhos;Fandangos Presunto 23g;R$ 1,25;Não
Atakarejo;Biscoitos e Salgadinhos;Mini Biscoito de Arroz Integral Sabor Pimenta Camil 150g;R$ 8,35;Sim
Atakarejo;Biscoitos e Salgadinhos;Pack Biscoito Original Vitarella Delicitá Pacote 138g 6 Unidades;R$ 5,19;Sim
Atakarejo;Biscoitos e Salgadinhos;Pack Biscoito Recheado de Morango Treloso Vitarella Pacote de 480g com 4 Unidades Leve Mais Pague Menos;R$ 7,78;Não
Atakarejo;Biscoitos e Salgadinhos;Pacote Biscoito Pão Na Chapa Pit Stop 6un Marilan 137g;R$ 3,68;Sim
Atakarejo;Biscoitos e Salgadinhos;Pipoca Doce Magrelita 100g;R$ 2,78;Não
Atakarejo;Biscoitos e Salgadinhos;Pipoca Doce Ok 90g;R$ 1,98;Não
Atakarejo;Biscoitos e Salgadinhos;Pipoca Doce Ok Embalagem 40g;R$ 0,89;Sim
Atakarejo;Biscoitos e Salgadinhos;Pipoca Pronta Doce Melado Magrela 45g;R$ 3,25;Não
Atakarejo;Biscoitos e Salgadinhos;Pipoca Pronta Salgada Magrela 35g;R$ 3,04;Não
Atakarejo;Biscoitos e Salgadinhos;Rosca de Coco Micos 500g;R$ 7,28;Sim
Atakarejo;Biscoitos e Salgadinhos;Rosquinha Banana com Canela Rancheiro 300g;R$ 3,85;Não
Atakarejo;Biscoitos e Salgadinhos;Rosquinha Micos Sabor Coco 300g;R$ 2,98;Sim
Atakarejo;Biscoitos e Salgadinhos;Rosquinha Rancheiro Coco 300g;R$ 3,78;Sim
Atakarejo;Biscoitos e Salgadinhos;Rosquinha Recheada de Orango Rancheiro 90g;R$ 2,45;Sim
Atakarejo;Biscoitos e Salgadinhos;Rosquinha Tradicional Sabor Coco Marilan 300g;R$ 5,88;Sim
Atakarejo;Biscoitos e Salgadinhos;Rosquinha de Chocolate Rancheiro 300g;R$ 3,78;Sim
Atakarejo;Biscoitos e Salgadinhos;Rosquinhas de Leite Micos 300g;R$ 2,98;Sim
Atakarejo;Biscoitos e Salgadinhos;Salg Cebolitos 23g;R$ 1,18;Não
Atakarejo;Biscoitos e Salgadinhos;Salg Levinhos 90g Pepper;R$ 2,35;Não
Atakarejo;Biscoitos e Salgadinhos;Salg Levinhos 90g Pim Jalap;R$ 2,59;Não
Atakarejo;Biscoitos e Salgadinhos;Salg Trigo Croys Galeto 40g;R$ 1,56;Não
Atakarejo;Biscoitos e Salgadinhos;Salgadadinho Flits Queijo 50g;R$ 1,40;Não
Atakarejo;Biscoitos e Salgadinhos;Salgadinho De Milho Assado Sabor Churrasco Mikão 41g;R$ 1,45;Sim
Atakarejo;Biscoitos e Salgadinhos;Salgadinho De Milho Assado sabor Presunto Mikão 41g;R$ 1,45;Sim
Atakarejo;Biscoitos e Salgadinhos;Salgadinho Elma Chips Cheetos Onda Requeijão Embalagem 23g;R$ 1,25;Não
Atakarejo;Biscoitos e Salgadinhos;Salgadinho Flits Galeto 28g;R$ 0,86;Não
Atakarejo;Biscoitos e Salgadinhos;Salgadinho Flits Sabor Queijo 28g;R$ 0,88;Não
Atakarejo;Biscoitos e Salgadinhos;Salgadinho Levinhos Costela Com Limão Sol 90g;R$ 2,35;Não
Atakarejo;Biscoitos e Salgadinhos;Salgadinho Lua Parmesão Elma Chips Cheetos 35g;R$ 3,25;Sim
Atakarejo;Biscoitos e Salgadinhos;Salgadinho Lua Sabor Queijo Yokitos 45g;R$ 1,79;Não
Atakarejo;Biscoitos e Salgadinhos;Salgadinho Micos Persicitos Salsa e Cebola;R$ 1,29;Não
Atakarejo;Biscoitos e Salgadinhos;Salgadinho Ok Assado Presunto 28g;R$ 0,75;Não
Atakarejo;Biscoitos e Salgadinhos;Salgadinho Ok Conexão Queijo 50g;R$ 1,64;Não
Atakarejo;Biscoitos e Salgadinhos;Salgadinho Ok Conexão Sabor Pimenta Malagueta 50g;R$ 1,38;Não
Atakarejo;Biscoitos e Salgadinhos;Salgadinho Ok Pururuca Tradicional 37g;R$ 2,10;Não
Atakarejo;Biscoitos e Salgadinhos;Salgadinho Ok Sabor Cebola Embalagem 45g;R$ 1,56;Não
Atakarejo;Biscoitos e Salgadinhos;Salgadinho Ok Sabor Pizza Embalagem 45g;R$ 1,56;Não
Atakarejo;Biscoitos e Salgadinhos;Salgadinho Ok Sabor Presunto Embalagem 50g;R$ 1,56;Não
Atakarejo;Biscoitos e Salgadinhos;Salgadinho Ok Sabor Queijo Embalagem 45g;R$ 1,56;Não
Atakarejo;Biscoitos e Salgadinhos;Salgadinho Ok Seeks Queijo Parmesão 45g;R$ 1,56;Não
Atakarejo;Biscoitos e Salgadinhos;Salgadinho Ok Xeeks Cebola 28g;R$ 0,75;Não
Atakarejo;Biscoitos e Salgadinhos;Salgadinho Ok Xeeks Galinha Caipira 28g;R$ 0,75;Não
Atakarejo;Biscoitos e Salgadinhos;Salgadinho Pimenta Bahia 40g;R$ 1,58;Não
Atakarejo;Biscoitos e Salgadinhos;Salgadinho Queijo Ok Xeeks 28 G;R$ 0,75;Não
Atakarejo;Biscoitos e Salgadinhos;Salgadinho Sabor Churrasco Gol de Ouro;R$ 1,55;Não
Atakarejo;Biscoitos e Salgadinhos;Salgadinho Sabor Galinha Caipira Mikão 90g;R$ 3,09;Não
Atakarejo;Biscoitos e Salgadinhos;Salgadinho Sabor Galinha Caipira Ok Xeeks 45g;R$ 1,56;Não
Atakarejo;Biscoitos e Salgadinhos;Salgadinho Sabor Queijo Flitão 140g;R$ 3,80;Não
Atakarejo;Biscoitos e Salgadinhos;Salgadinho Yokitos Bolinhas Queijo 45g;R$ 1,79;Não
Atakarejo;Biscoitos e Salgadinhos;Salgadinho Yokitos Cebola 54g;R$ 1,99;Não
Atakarejo;Biscoitos e Salgadinhos;Salgadinho Yokitos Conchinhas Presunto 54g;R$ 1,99;Não
Atakarejo;Biscoitos e Salgadinhos;Salgadinho Yokitos Redinha Sabor Requeijão 45g;R$ 1,79;Não
Atakarejo;Biscoitos e Salgadinhos;Salgadinho Yokitos Tubinho Queijo 45g;R$ 1,79;Não
Atakarejo;Biscoitos e Salgadinhos;Salgadinho de Milho Flits Cebola 50g;R$ 1,40;Não
Atakarejo;Biscoitos e Salgadinhos;Salgadinho de Milho Sabor Cebola Cebolitos Elma Chips 91g;R$ 8,49;Não
Atakarejo;Biscoitos e Salgadinhos;Salgadinho de Milho Sabor Cebola Mikão 41g;R$ 1,45;Sim
Atakarejo;Biscoitos e Salgadinhos;Salgadinho de Milho Sabor Galeto Flits 45g;R$ 1,38;Não
Atakarejo;Biscoitos e Salgadinhos;Salgadinho de Milho Sabor Presunto Fandangos Elma Chips 35g;R$ 2,45;Não
Atakarejo;Biscoitos e Salgadinhos;Salgadinho de Milho Sabor Queijo Fandangos Elma Chips 35g;R$ 2,48;Não
Atakarejo;Biscoitos e Salgadinhos;Salgadinho de Milho Sabor Queijo Nacho Doritos 32g;R$ 4,39;Sim
Atakarejo;Biscoitos e Salgadinhos;Salgadinho de Milho Sabor Queijo Nacho Doritos 75g;R$ 8,49;Sim
Atakarejo;Biscoitos e Salgadinhos;Salgadinho de Milho Sabor Requeijao Ok 28g;R$ 0,75;Não
Atakarejo;Biscoitos e Salgadinhos;Salgadinho de Milho Sabor Requeijão Cheetos Onda Elma Chips 40g;R$ 3,25;Não
Atakarejo;Biscoitos e Salgadinhos;Salgadinho de Queijo Mikão 120g;R$ 4,86;Não
Atakarejo;Biscoitos e Salgadinhos;Salgadinho de Queijo Mikão 90g;R$ 3,09;Não
Atakarejo;Biscoitos e Salgadinhos;Salgadinho de Requeijão Mikão 90g;R$ 3,09;Não
Atakarejo;Biscoitos e Salgadinhos;Salgadinho de Trigo Bacon Levinho's 50g;R$ 1,58;Não
Atakarejo;Biscoitos e Salgadinhos;Salgadinho de Trigo Cebola e Salsa Levinho's 50g;R$ 1,58;Não
Atakarejo;Biscoitos e Salgadinhos;Salgadinho de Trigo Churrasco Levinho's 50g;R$ 1,39;Não
Atakarejo;Biscoitos e Salgadinhos;Salgadinho de Trigo Pepperoni Comida Di Buteco Piraquê 50g;R$ 2,25;Não
Atakarejo;Biscoitos e Salgadinhos;Salgadinho de Trigo Pimenta Levinho's 50g;R$ 1,39;Não
Atakarejo;Biscoitos e Salgadinhos;Salgadinho de Trigo Presunto Levinho's 50g;R$ 1,58;Não
Atakarejo;Biscoitos e Salgadinhos;Salgadinhos Peticitos Carne de Sol 40g;R$ 1,29;Não
Atakarejo;Biscoitos e Salgadinhos;Salgadinhos Peticitos Queijo 40g;R$ 1,29;Não
Atakarejo;Biscoitos e Salgadinhos;Salgadinhos de Milho Sortidos 25g Cada Ok Xeeks 10un;R$ 0,75;Não
Atakarejo;Biscoitos e Salgadinhos;Sequilho Coco Vale do Prata Embalagem 200g;R$ 8,28;Não
Atakarejo;Biscoitos e Salgadinhos;Sequilho Vale do Prata Leite Pacote 200g;R$ 8,28;Não
Atakarejo;Biscoitos e Salgadinhos;Sequilhos de Coco Sequilhato 100g;R$ 8,50;Não
Atakarejo;Biscoitos e Salgadinhos;Snack Panetini Presunto Defumado Eqlibri 40g;R$ 3,58;Não
Atakarejo;Biscoitos e Salgadinhos;Snack Panetini Queijo Suave Eqlibri 40g;R$ 3,58;Não
Atakarejo;Biscoitos e Salgadinhos;Snack Tomate Mucilon 35g;R$ 4,39;Não
Atakarejo;Biscoitos e Salgadinhos;Snack Trigo Pimenta Vitoria 40g;R$ 1,56;Não
Atakarejo;Biscoitos e Salgadinhos;Snack de Batata Cebola e Salsa Piraquê 60g;R$ 4,85;Não
Atakarejo;Biscoitos e Salgadinhos;Tortinhas Amorim Recheada de Chocolate Richester Pacote 140g;R$ 4,06;Não
Atakarejo;Biscoitos e Salgadinhos;Wafer Montevergine Tub In 48g Chocolate;R$ 2,49;Não
Atakarejo;Biscoitos e Salgadinhos;Wafer Recheado Ouro Branco Mondelez 25g;R$ 2,05;Não
Atakarejo;Frios e Laticínios;Alimento À Base de Manteiga e Creme de Vegetal com Sal Favorita 500g;R$ 9,38;Não
Atakarejo;Frios e Laticínios;Apresuntado Aurora Fatiado Retangular Kg;R$ 14,56;Não
Atakarejo;Frios e Laticínios;Apresuntado Peperi Fatiado Kg;R$ 10,55;Não
Atakarejo;Frios e Laticínios;Apresuntado Retangular Frilanche Frimesa Kg;R$ 13,76;Não
Atakarejo;Frios e Laticínios;Blanquet Peru Light Cozido Sadia Fatiado Kg;R$ 1,96;Não
Atakarejo;Frios e Laticínios;Chantilly Gran Finale Fleischmann 1l;R$ 21,39;Sim
Atakarejo;Frios e Laticínios;Chantilly Mix Amelia 1l;R$ 19,59;Sim
Atakarejo;Frios e Laticínios;Chantilly Polenghi Spray 250g;R$ 40,55;Não
Atakarejo;Frios e Laticínios;Cream Cheese Cremoso Light Vigor 150g;R$ 11,28;Não
Atakarejo;Frios e Laticínios;Cream Cheese Light Danubio 300g;R$ 21,29;Não
Atakarejo;Frios e Laticínios;Cream Cheese Tradicional Danubio 150g;R$ 12,52;Não
Atakarejo;Frios e Laticínios;Cream Cheese Tradicional Vigor 300g;R$ 19,16;Não
Atakarejo;Frios e Laticínios;Creme Chantilly Gran Finale Fleischmann 200ml;R$ 6,28;Não
Atakarejo;Frios e Laticínios;Creme Hidratante Elseve Liso Dos Sonhos Aha+Queratina 300gr;R$ 35,54;Sim
Atakarejo;Frios e Laticínios;Creme Milk Pizza Culinária 1,5kg;R$ 11,86;Não
Atakarejo;Frios e Laticínios;Creme Vegetal Original com Sal Becel 250g;R$ 7,85;Sim
Atakarejo;Frios e Laticínios;Creme Vegetal Original com Sal Becel 500g;R$ 14,79;Não
Atakarejo;Frios e Laticínios;Creme de Chantilly Gran Finale Fleischmann 500ml;R$ 12,49;Sim
Atakarejo;Frios e Laticínios;Creme de Ricota Light Tirolez 200g;R$ 9,79;Não
Atakarejo;Frios e Laticínios;Creme para Tratamento Hidra Hialuronico Elseve Pote 300g;R$ 26,02;Sim
Atakarejo;Frios e Laticínios;F. Queijo Piracanjuba Coalho Fatiado 150g;R$ 12,30;Não
Atakarejo;Frios e Laticínios;Lombo Canadense Seara Fatiado;R$ 15,98;Não
Atakarejo;Frios e Laticínios;Lombo Defumado Kg;R$ 5,54;Não
Atakarejo;Frios e Laticínios;Lombo Levíssimo Seara Kg;R$ 22,44;Não
Atakarejo;Frios e Laticínios;Lombo Nobre Fatiado;R$ 8,69;Não
Atakarejo;Frios e Laticínios;Lombo Suíno Salgado Kg;R$ 4,63;Não
Atakarejo;Frios e Laticínios;Lombo Suíno Saudali Congelado Kg;R$ 39,14;Não
Atakarejo;Frios e Laticínios;Manteiga Bela Nata com Sal Pote 200g;R$ 10,80;Sim
Atakarejo;Frios e Laticínios;Manteiga Comum com Sal Itacolomy 200g;R$ 14,45;Não
Atakarejo;Frios e Laticínios;Manteiga Comum com Sal Itacolomy 500g;R$ 21,80;Não
Atakarejo;Frios e Laticínios;Manteiga Extra com Sal Catupiry Pote 200g;R$ 16,39;Não
Atakarejo;Frios e Laticínios;Manteiga Linda Mineira 500g;R$ 22,80;Sim
Atakarejo;Frios e Laticínios;Manteiga Natville Embalagem 200g;R$ 9,39;Não
Atakarejo;Frios e Laticínios;Manteiga Original de Minas Embalagem 200g;R$ 9,90;Não
Atakarejo;Frios e Laticínios;Manteiga Original de Minas Embalagem 500g;R$ 24,80;Não
Atakarejo;Frios e Laticínios;Manteiga Piracanjuba com Sal 500g;R$ 27,80;Sim
Atakarejo;Frios e Laticínios;Manteiga Piracanjuba com Sal Zero Lactose 200g;R$ 16,39;Não
Atakarejo;Frios e Laticínios;Manteiga com Sal Davaca 200g;R$ 10,80;Não
Atakarejo;Frios e Laticínios;Manteiga com Sal Davaca 500g;R$ 23,79;Sim
Atakarejo;Frios e Laticínios;Manteiga com Sal Itambé Primeira Qualidade 500g;R$ 28,80;Não
Atakarejo;Frios e Laticínios;Manteiga com Sal Natural da Vaca 500g;R$ 18,02;Não
Atakarejo;Frios e Laticínios;Manteiga com Sal Natville Embalagem 500g;R$ 21,80;Não
Atakarejo;Frios e Laticínios;Manteiga com Sal Zero Lactose Davaca 200g;R$ 12,80;Sim
Atakarejo;Frios e Laticínios;Margarina Amanteigado com Sal Becel 500g;R$ 14,79;Não
Atakarejo;Frios e Laticínios;Margarina Aéra com Sal Qualy 500 g;R$ 11,95;Não
Atakarejo;Frios e Laticínios;Margarina Claybom Sabor Manteiga com Sal 250g;R$ 3,98;Não
Atakarejo;Frios e Laticínios;Margarina Com Sal E Creme de Leite Delicia 500g;R$ 7,48;Sim
Atakarejo;Frios e Laticínios;Margarina Cremosa Com Sal Qualy 1kg;R$ 18,98;Sim
Atakarejo;Frios e Laticínios;Margarina Cremosa Com Sal Qualy 250g;R$ 5,48;Não
Atakarejo;Frios e Laticínios;Margarina Cremosa Sem Sal Qualy 250g;R$ 5,48;Não
Atakarejo;Frios e Laticínios;Margarina Cremosa Sem Sal Qualy 500g;R$ 10,45;Não
Atakarejo;Frios e Laticínios;Margarina Cremosa com Sal Qualy 500g;R$ 10,45;Sim
Atakarejo;Frios e Laticínios;Margarina Deline com Sal Embalagem 3kg;R$ 26,89;Sim
Atakarejo;Frios e Laticínios;Margarina Deline com Sal Pote 1kg;R$ 11,78;Sim
Atakarejo;Frios e Laticínios;Margarina Deline com Sal Pote 250g;R$ 2,79;Sim
Atakarejo;Frios e Laticínios;Margarina Deline com Sal Pote 500g;R$ 6,38;Sim
Atakarejo;Frios e Laticínios;Margarina Manteiga Cremosa com Sal Claybom Perdigão 1kg;R$ 13,68;Não
Atakarejo;Frios e Laticínios;Margarina Medalha de Ouro 80% Lipídios 15kg;R$ 196,29;Não
Atakarejo;Frios e Laticínios;Margarina Original sem Sal Zero lactose Becel 500g;R$ 14,79;Não
Atakarejo;Frios e Laticínios;Margarina Qualy Zero Lactose com Sal Light Embalagem 250g;R$ 5,48;Não
Atakarejo;Frios e Laticínios;Margarina com Sal Claybom 1kg;R$ 8,98;Sim
Atakarejo;Frios e Laticínios;Margarina com Sal Claybom 250g;R$ 3,49;Não
Atakarejo;Frios e Laticínios;Margarina com Sal Claybom Perdigão 500g;R$ 6,55;Não
Atakarejo;Frios e Laticínios;Margarina com Sal e Creme de Leite Embalagem Econômica Delícia 1kg;R$ 14,25;Sim
Atakarejo;Frios e Laticínios;Margarina sem Sal Qualy Vita 500 g;R$ 11,95;Não
Atakarejo;Frios e Laticínios;Massa De Concha De Semolina Bahia 400g;R$ 3,89;Não
Atakarejo;Frios e Laticínios;Massa Espag Yara No 0 400g Un Un;R$ 2,78;Não
Atakarejo;Frios e Laticínios;Massa Fresca de Pastel Cumbuca Massa Leve 400g;R$ 5,99;Não
Atakarejo;Frios e Laticínios;Massa Fresca para Pastel Massafest Embalagem 200g;R$ 3,19;Não
Atakarejo;Frios e Laticínios;Massa Fresca para Pastel Massafest Industrial 500g;R$ 6,99;Não
Atakarejo;Frios e Laticínios;Massa Fresca para Pastel Mineira Embalagem 500g;R$ 42,08;Não
Atakarejo;Frios e Laticínios;Massa Parafuso Bahia 400g;R$ 3,35;Não
Atakarejo;Frios e Laticínios;Massa para Pastel Cumbuca Massa Leve 500g;R$ 6,99;Não
Atakarejo;Frios e Laticínios;Massa para Pastel Discão Massa Leve 500g;R$ 7,00;Não
Atakarejo;Frios e Laticínios;Massa para Pastel Massafest Embalagem 500g;R$ 6,99;Não
Atakarejo;Frios e Laticínios;Massa para Pizza de Frigideira Massa Leve Pacote 250g;R$ 10,90;Não
Atakarejo;Frios e Laticínios;Massas Frescas Massaleve Capeletti de Queijo Embalagem 400g;R$ 12,79;Não
Atakarejo;Frios e Laticínios;Mortadela Defumada Seara Fatiada;R$ 3,22;Não
Atakarejo;Frios e Laticínios;Mortadela Perdigão 1kg;R$ 12,69;Não
Atakarejo;Frios e Laticínios;Mortadela Perdigão 400g;R$ 5,89;Não
Atakarejo;Frios e Laticínios;Mortadela Sadia Mista 400g;R$ 5,49;Não
Atakarejo;Frios e Laticínios;Mortadela de Frango Sadia Sadilar 400g;R$ 5,39;Não
Atakarejo;Frios e Laticínios;Peito Peru Defumado Sadia Fatiado Kg;R$ 3,67;Não
