mercado;categoria;produto;preco;produto_nos_dois
Atacadão;Limpeza;Desinfetante de Lavanda Spray Lysoform 360ml;R$ 29,05;Não
Atacadão;Limpeza;Desodorizador Aerossol Brisa Cítrica de Verão Glade 360ml;R$ 18,25;Não
Atacadão;Limpeza;Desodorizador Automatic Spray Frescor de Águas Florais Glade Refil 269ml;R$ 30,78;Não
Atacadão;Limpeza;Desodorizador Gel Pequenos Ambientes Citrus Glade 70g;R$ 8,52;Não
Atacadão;Limpeza;Desodorizador Gel Pequenos Ambientes Lavanda Glade 70g;R$ 8,52;Não
Atacadão;Limpeza;Desodorizador Sanitário Gel Adesivo Marine Pato Refil 6 Discos Aparelho Grátis;R$ 16,09;Não
Atacadão;Limpeza;Desodorizador Sanitário Gel Pato 38g Aplicador Grátis Lavanda;R$ 16,09;Não
Atacadão;Limpeza;Desodorizador Sanitário Jasmim, Lavanda e Pinho Zap Clean 3un;R$ 7,45;Não
Atacadão;Limpeza;Desodorizador Sanitário em Pastilha Adesiva Fresh Pato 3un;R$ 8,31;Sim
Atacadão;Limpeza;Desodorizador Toque de Frescor Aparelho + Refil Lavanda Glade 12ml;R$ 21,38;Não
Atacadão;Limpeza;Desodorizador Toque de Maciez Oferta Glade 269ml;R$ 30,78;Não
Atacadão;Limpeza;Desodorizador de Ambiente Glade Toque de Frescor Lavanda Refil 12ml;R$ 14,56;Não
Atacadão;Limpeza;Desodorizador de Ambiente Lembrança de Infância Embalagem Econômica Glade Aerosol 360ml;R$ 18,25;Não
Atacadão;Limpeza;Desumidificador Kids Secar 180g;R$ 9,61;Não
Atacadão;Limpeza;Detergente Atol Neutro 2l;R$ 8,62;Sim
Atacadão;Limpeza;Detergente Clear Teiú 500ml;R$ 1,78;Sim
Atacadão;Limpeza;Detergente Em Pastilhas para Lava Louças Limpol 315g 20 Pastilhas;R$ 26,89;Não
Atacadão;Limpeza;Detergente Em Pó Espumil Flores 400g;R$ 1,45;Sim
Atacadão;Limpeza;Detergente Em Pó Lavanda Espumil 400g;R$ 1,45;Sim
Atacadão;Limpeza;Detergente Em Pó Para Lavar Roupas Espumil Flores;R$ 5,17;Não
Atacadão;Limpeza;Detergente Liquido Ypê Neutro 5l;R$ 26,67;Não
Atacadão;Limpeza;Detergente Líquido Atol Neutro 5l;R$ 19,96;Não
Atacadão;Limpeza;Detergente Líquido Clear Lisa 500ml;R$ 1,67;Não
Atacadão;Limpeza;Detergente Líquido Clear Ypê 500ml;R$ 3,12;Não
Atacadão;Limpeza;Detergente Líquido Cristal Limpol 500ml;R$ 2,14;Sim
Atacadão;Limpeza;Detergente Líquido Lisa Clear 2 Litros;R$ 7,12;Não
Atacadão;Limpeza;Detergente Líquido Lisa Limão Embalagem 500ml;R$ 1,67;Sim
Atacadão;Limpeza;Detergente Líquido Lisa Maçã 500ml;R$ 1,67;Não
Atacadão;Limpeza;Detergente Líquido Lisa Neutro 500ml;R$ 1,67;Sim
Atacadão;Limpeza;Detergente Líquido Neutro Limpol 5l;R$ 26,89;Não
Atacadão;Limpeza;Detergente Líquido Neutro Limpol Squeeze 500ml;R$ 2,14;Não
Atacadão;Limpeza;Detergente Líquido Neutro Lisa Embalagem 2l;R$ 7,12;Não
Atacadão;Limpeza;Detergente Líquido Neutro Teiú 2l;R$ 8,42;Sim
Atacadão;Limpeza;Detergente Líquido Neutro Teiú 500ml;R$ 1,78;Sim
Atacadão;Limpeza;Detergente Líquido Teiu Neutro 5 Litros;R$ 19,33;Sim
Atacadão;Limpeza;Detergente Líquido Ypê Neutro 7 Litros;R$ 35,53;Não
Atacadão;Limpeza;Detergente Líquido de Coco Limpol 500ml;R$ 2,14;Sim
Atacadão;Limpeza;Detergente Líquido de Coco Lisa 500ml;R$ 1,67;Não
Atacadão;Limpeza;Detergente Líquido de Coco Ypê 500ml;R$ 3,12;Não
Atacadão;Limpeza;Detergente Líquido de Limão Limpol 500ml;R$ 2,14;Não
Atacadão;Limpeza;Detergente Líquido de Maçã Teiú 500ml;R$ 1,78;Não
Atacadão;Limpeza;Detergente Po Ala Lavanda;R$ 17,80;Sim
Atacadão;Limpeza;Detergente Po Ala Lavanda;R$ 9,39;Sim
Atacadão;Limpeza;Detergente Po Ala Rosas E Flor De Lis;R$ 9,39;Sim
Atacadão;Limpeza;Detergente Po Apyce Multiacao;R$ 64,69;Não
Atacadão;Limpeza;Detergente Sanitário para Caixa Acoplada Tablete Perfumado Leve Brisa 50g;R$ 12,40;Não
Atacadão;Limpeza;Detergente Teiú Coco 500ml;R$ 1,78;Não
Atacadão;Limpeza;Detergente Teiú Limão 500ml;R$ 1,78;Sim
Atacadão;Limpeza;Detergente Ypê Capim Limão 500ml;R$ 3,12;Sim
Atacadão;Limpeza;Detergente Ypê Clear 5l;R$ 26,67;Não
Atacadão;Limpeza;Detergente Ypê Limão 500ml;R$ 3,12;Sim
Atacadão;Limpeza;Detergente Ypê Maçã 500ml;R$ 3,12;Sim
Atacadão;Limpeza;Detergente Ypê Neutro 500ml;R$ 3,12;Sim
Atacadão;Limpeza;Detergente em Pó Maciez Tixan Ypê 1,6kg;R$ 20,41;Sim
Atacadão;Limpeza;Detergente em Pó Maciez Tixan Ypê 400g;R$ 4,52;Não
Atacadão;Limpeza;Detergente em Pó Tripla Ação Floral Assim 400g;R$ 4,09;Não
Atacadão;Limpeza;Detergente em Pó para Roupas Cuidado do Coco Ala 1,6kg;R$ 17,80;Sim
Atacadão;Limpeza;Detergente para Lava Louças Em Tabletes Finish Quantum Ultimate Com 10 Unidades;R$ 32,29;Não
Atacadão;Limpeza;Difusor Elétrico Bom Ar Lavanda E Gerânio Aparelho + Refil 16ml;R$ 24,28;Não
Atacadão;Limpeza;Difusor Elétrico Bom Ar Lavanda e Gerânio Refil Air Wick 16ml;R$ 21,49;Não
Atacadão;Limpeza;Difusor Elétrico Bom Ar Lirio Branco E Algodão Aparelho + Refil 16ml;R$ 23,65;Não
Atacadão;Limpeza;Difusor Elétrico Frescor da Mata Bom Ar Refil 16ml;R$ 21,49;Não
Atacadão;Limpeza;Difusor Elétrico de Ambiente Lírio Branco e Algodão Bom Ar Refil Air Wick 16ml;R$ 21,49;Não
Atacadão;Limpeza;Difusor Secar Aromas Rubi 100ml;R$ 17,80;Não
Atacadão;Limpeza;Difusor de Ambiente Lavanda Glade 100ml;R$ 20,50;Não
Atacadão;Limpeza;Difusor de Ambiente Lembranças de Infância Glade 100ml;R$ 20,50;Não
Atacadão;Limpeza;Difusor de Aromas Alecrim Secar 100ml;R$ 12,42;Não
Atacadão;Limpeza;Difusor de Aromas Brisa Cítrica de Verão Glade 100ml;R$ 20,50;Não
Atacadão;Limpeza;Difusor de Aromas Cereja com Avelã Coala 100ml;R$ 12,85;Não
Atacadão;Limpeza;Difusor de Aromas Charm Lavanda de Paris Secar 150ml;R$ 24,30;Não
Atacadão;Limpeza;Difusor de Aromas Chá Branco Coala 100ml;R$ 12,85;Não
Atacadão;Limpeza;Difusor de Aromas Chá Branco Secar 100ml;R$ 12,42;Não
Atacadão;Limpeza;Difusor de Aromas Frutas e Flores Vibrantes Glade 100ml;R$ 20,50;Sim
Atacadão;Limpeza;Difusor de Aromas Lavanda Coala 100ml;R$ 12,85;Não
Atacadão;Limpeza;Difusor de Aromas Lavanda Secar 100ml;R$ 12,42;Não
Atacadão;Limpeza;Difusor de Aromas Romã Coala 100ml;R$ 12,85;Não
Atacadão;Limpeza;Difusor de Aromas Secar Entusiasmo Bamboo Fresh Embalagem 100ml;R$ 12,42;Não
Atacadão;Limpeza;Difusor de Aromas Secar Esmeralda 100ml;R$ 17,80;Não
Atacadão;Limpeza;Difusor de Aromas Sensual Secar 100ml;R$ 12,42;Não
Atacadão;Limpeza;Enxuga Tudo Grande Pano Pva Luxcar;R$ 36,61;Não
Atacadão;Limpeza;Escova Noviça Adapt 1un;R$ 13,93;Não
Atacadão;Limpeza;Escova Noviça Bettajeans 1un;R$ 8,53;Sim
Atacadão;Limpeza;Escova Sanitária Condor 1un;R$ 9,61;Não
Atacadão;Limpeza;Escova Sanitária com Suporte Condor;R$ 15,01;Não
Atacadão;Limpeza;Esponja Alklin Multiuso Embalagem 1 Un;R$ 0,70;Não
Atacadão;Limpeza;Esponja Bombril Multiuso Oferta 4un;R$ 5,71;Sim
Atacadão;Limpeza;Esponja Brilhus Dupla Face Oferta 4 Unidades;R$ 3,22;Sim
Atacadão;Limpeza;Esponja Brilhus Multiuso 1 Unidade;R$ 0,91;Não
Atacadão;Limpeza;Esponja Brilux Multiuso Embalagem Leve 4un Pague 3un;R$ 5,67;Não
Atacadão;Limpeza;Esponja Dupla Face para Banho Fresh Banho Ober;R$ 2,04;Não
Atacadão;Limpeza;Esponja Esfrebom Sfreg Dupla Face 2 Un;R$ 3,76;Não
Atacadão;Limpeza;Esponja Grill Scotch Brite;R$ 10,03;Não
Atacadão;Limpeza;Esponja Laranja Não Risca Louças Delicadas Antibac Scotch Brite 3un;R$ 8,10;Sim
Atacadão;Limpeza;Esponja Limpeza Pesada Tinindo Leve 4 Pague 3;R$ 3,76;Não
Atacadão;Limpeza;Esponja Multiuso 3m Limpabela 1un;R$ 1,06;Não
Atacadão;Limpeza;Esponja Multiuso Assolan Pertuto 1un;R$ 0,96;Não
Atacadão;Limpeza;Esponja Multiuso Bombril 1 Un;R$ 2,04;Não
Atacadão;Limpeza;Esponja Multiuso Esfrebom Leve 4 Pague 3un;R$ 5,92;Sim
Atacadão;Limpeza;Esponja Multiuso Esfrelux L4p3;R$ 3,44;Não
Atacadão;Limpeza;Esponja Multiuso Scotch Brite;R$ 2,58;Não
Atacadão;Limpeza;Esponja Multiuso Tinindo Un;R$ 2,14;Não
Atacadão;Limpeza;Esponja Multiuso Vip Santa Maria 1 Un;R$ 0,70;Não
Atacadão;Limpeza;Esponja Não Risca Ypê 3un;R$ 6,14;Não
Atacadão;Limpeza;Esponja Salva Unha Scotch Brite;R$ 4,84;Não
Atacadão;Limpeza;Esponja Santa Maria Esfrelux Soft para Inox Embalagem 3 Un;R$ 4,63;Não
Atacadão;Limpeza;Esponja Santa Maria Limp Grill Embalagem 1 Un;R$ 9,16;Não
Atacadão;Limpeza;Esponja Scotch Brite Não Risca Laranja 1un;R$ 3,99;Não
Atacadão;Limpeza;Esponja Scotch Brite Salva Unhas Embalagem 1 Unidade;R$ 11,77;Não
Atacadão;Limpeza;Esponja Scotch-Brite Extrema 1 Un;R$ 3,98;Sim
Atacadão;Limpeza;Esponja Verde Esfera de Limpeza Scotch Brite 3un;R$ 8,08;Não
Atacadão;Limpeza;Esponja de Aço Assolam Ypê 45g;R$ 1,17;Não
Atacadão;Limpeza;Esponja de Aço Bombril 60g;R$ 1,78;Sim
Atacadão;Limpeza;Esponja de Aço Q'lustro 6un 40g;R$ 1,35;Sim
Atacadão;Limpeza;Esponja de Limpeza Extrema Scotch-Brite 4un;R$ 7,54;Não
Atacadão;Limpeza;Esponja de Limpeza Multiuso Scotch-brite Leve 4 Pague 3;R$ 5,92;Sim
Atacadão;Limpeza;Esponja de Microfibra Belmax Embalagem 1un;R$ 25,81;Não
Atacadão;Limpeza;Evita Mofo Pastilha Leve Brisa 25g;R$ 4,21;Não
Atacadão;Limpeza;Evita Mofo Secar Embalagem 80g Leve 4 Un Pague 3 Un;R$ 17,17;Não
Atacadão;Limpeza;Evita Mofo Secar Lavanda 80g;R$ 6,37;Não
Atacadão;Limpeza;Facilitador Spray de Passar Roupas 4 Em 1 Passe Bem 500ml;R$ 23,74;Não
Atacadão;Limpeza;Facilitador de Passar Roupas 4 Em 1 Passe Bem Refil 400ml;R$ 15,01;Não
Atacadão;Limpeza;Flanela Algobom Ouro 28x48;R$ 4,30;Não
Atacadão;Limpeza;Flanela Cor Laranja 28x48cm Alklin;R$ 4,63;Não
Atacadão;Limpeza;Flanela Super Luxo Celeste 3un;R$ 23,65;Não
Atacadão;Limpeza;Flanela de Algodão Santa Margarida 28x38cm Embalagem 1un;R$ 1,93;Não
Atacadão;Limpeza;Gel Adesivo Marine + Aplicador Pato 38g;R$ 24,73;Não
Atacadão;Limpeza;Gel Adesivo Sanitário Refil Marine Pato com 6un;R$ 15,76;Não
Atacadão;Limpeza;Gel Sanit Leve Brisa Refil Marine 35g;R$ 13,93;Não
Atacadão;Limpeza;Gel Sanitário Adesivo Leve Brisa Lavanda Aparelho + Refil 36g;R$ 17,17;Não
Atacadão;Limpeza;Inseticida Aerosol Ação Total Baygon 360ml;R$ 17,17;Sim
Atacadão;Limpeza;Inseticida Aerosol Ação Total Óleo de Eucalipto Baygon 360ml;R$ 17,17;Sim
Atacadão;Limpeza;Inseticida Aerossol Ação Magnética Base Água Sbp 360ml;R$ 21,49;Não
Atacadão;Limpeza;Inseticida Aerossol Sbp Multi 380ml Embalagem Econômica;R$ 13,93;Sim
Atacadão;Limpeza;Inseticida Aerossol Ultra Baygon 360ml;R$ 17,80;Não
Atacadão;Limpeza;Inseticida Aerossol Óleo de Citronela Sbp Multi 380ml Embalagem Econômica;R$ 13,93;Sim
Atacadão;Limpeza;Inseticida Aerossol Óleo de Eucalipto Sbp Multi 450ml Leve+ Pague-;R$ 21,06;Não
Atacadão;Limpeza;Inseticida Aerossol Óleo de Eucalipto Sbp Multi Embalagem Econômica 380ml;R$ 13,93;Sim
Atacadão;Limpeza;Inseticida Ação Total Raid 360ml;R$ 17,17;Sim
Atacadão;Limpeza;Inseticida Boa Noite Original Espiral 96g;R$ 5,13;Não
Atacadão;Limpeza;Inseticida Elétrica Refil Mat Inset Pague 10 Leve 12un;R$ 3,22;Não
Atacadão;Limpeza;Inseticida Iscas Mata Baratas Baygon com 6un;R$ 30,13;Sim
Atacadão;Limpeza;Inseticida Mat Inset Multi Inseticidas Aerosol 360ml;R$ 15,01;Não
Atacadão;Limpeza;Inseticida Mat Inset Multi sem Cheiro Aerosol 360 Ml;R$ 15,01;Não
Atacadão;Limpeza;Inseticida Multi Mat Inset Eucalipto Embalagem 400ml Grátis +33%;R$ 15,01;Não
Atacadão;Limpeza;Inseticida Sbp Multi Citronela Lv450ml Pg300ml;R$ 21,06;Não
Atacadão;Limpeza;Inseticida Straik Gel Mata Formigas Embalagem 10g;R$ 21,06;Não
Atacadão;Limpeza;Inseticidaiscas Mata Baratas Mortein com 6un;R$ 24,39;Não
Atacadão;Alimentos Básicos;Adoçante Colinário em Pó Adocyl 150g;R$ 17,17;Não
Atacadão;Alimentos Básicos;Adoçante Líquido Adocyl 100ml;R$ 4,30;Sim
Atacadão;Alimentos Básicos;Adoçante Líquido Adocyl com Stevia 80ml;R$ 7,87;Não
Atacadão;Alimentos Básicos;Adoçante Líquido Assugrin 100ml;R$ 3,76;Não
Atacadão;Alimentos Básicos;Adoçante Líquido Stevia Linea 60ml;R$ 13,50;Não
Atacadão;Alimentos Básicos;Adoçante Líquido Sucralose Linea 75ml;R$ 13,81;Não
Atacadão;Alimentos Básicos;Adoçante Líquido Zero Cal 100ml;R$ 5,92;Sim
Atacadão;Alimentos Básicos;Adoçante Marata Sucralose 100ml;R$ 9,16;Sim
Atacadão;Alimentos Básicos;Adoçante Natural Zero Cal Eritritol 65ml;R$ 16,09;Não
Atacadão;Alimentos Básicos;Adoçante Pó Linea 100% Stevia 30g com 50un;R$ 10,69;Não
Atacadão;Alimentos Básicos;Adoçante Stévia Zero Cal 80ml;R$ 13,50;Não
Atacadão;Alimentos Básicos;Adoçante Sucralose Adocyl 80ml;R$ 7,87;Não
Atacadão;Alimentos Básicos;Adoçante de Sucralose Zero Cal 100ml;R$ 10,69;Não
Atacadão;Alimentos Básicos;Adoçante em Pó Marata 40g;R$ 8,08;Não
Atacadão;Alimentos Básicos;Adoçante em Pó Tal e Qual 60g;R$ 11,77;Não
Atacadão;Alimentos Básicos;Amido de Milho Kimimo 200g;R$ 4,30;Sim
Atacadão;Alimentos Básicos;Amido de Milho Kimimo 500g;R$ 9,61;Sim
Atacadão;Alimentos Básicos;Amido de Milho Maizena 200g;R$ 5,06;Sim
Atacadão;Alimentos Básicos;Amido de Milho Maizena 500g;R$ 12,85;Sim
Atacadão;Alimentos Básicos;Amido de Milho Tradicional Maizena 720g;R$ 17,17;Sim
Atacadão;Alimentos Básicos;Arroz 7 Grãos Integrais + Quinoa Tio João 500g;R$ 8,62;Sim
Atacadão;Alimentos Básicos;Arroz Arbório Urbano 1kg;R$ 20,41;Não
Atacadão;Alimentos Básicos;Arroz Branco Tipo 1 Camil 1kg;R$ 5,38;Sim
Atacadão;Alimentos Básicos;Arroz Branco Tipo 1 Tio João 1kg;R$ 7,54;Sim
Atacadão;Alimentos Básicos;Arroz Branco Tipo 1 Tio Urbano 1kg;R$ 5,38;Sim
Atacadão;Alimentos Básicos;Arroz Caçarola Tipo 1 Parboilizado 1kg;R$ 4,20;Não
Atacadão;Alimentos Básicos;Arroz Integral 7 Grãos Urbano 1kg;R$ 15,01;Não
Atacadão;Alimentos Básicos;Arroz Integral Tipo 1 Urbano 1kg;R$ 5,38;Sim
Atacadão;Alimentos Básicos;Arroz Parboilizado Integral Camil 1kg;R$ 6,25;Não
Atacadão;Alimentos Básicos;Arroz Parboilizado Namorado Pacote 1kg;R$ 4,84;Sim
Atacadão;Alimentos Básicos;Arroz Parboilizado Pop Tipo 2 Embalagem 1kg;R$ 4,20;Não
Atacadão;Alimentos Básicos;Arroz Parbolizado Camil 1kg;R$ 5,17;Sim
Atacadão;Alimentos Básicos;Arroz Parbolizado Tio João 1kg;R$ 5,71;Sim
Atacadão;Alimentos Básicos;Arroz Tipo 1 Emoções Branco Beneficiado Embalagem 1kg;R$ 5,17;Sim
Atacadão;Alimentos Básicos;Arroz Tipo 1 Namorado 1kg;R$ 4,63;Sim
Atacadão;Alimentos Básicos;Arroz Tipo 1 Parabolizado Emoções 1kg;R$ 5,06;Sim
Atacadão;Alimentos Básicos;Arroz Tipo 1 Parboilizado Urbano 1kg;R$ 4,63;Sim
Atacadão;Alimentos Básicos;Arrozina Tradicional Maizena 180g;R$ 6,03;Sim
Atacadão;Alimentos Básicos;Azeite Dende Cepera 100ml;R$ 10,69;Não
Atacadão;Alimentos Básicos;Azeite Oliva Extra Virgem Gallo 500ml;R$ 40,93;Sim
Atacadão;Alimentos Básicos;Azeite Oliva Gallo 200ml;R$ 19,33;Não
Atacadão;Alimentos Básicos;Azeite de Dendê Cepêra 900ml;R$ 39,85;Não
Atacadão;Alimentos Básicos;Azeite de Dendê Mil Embalagem 200ml;R$ 3,33;Sim
Atacadão;Alimentos Básicos;Azeite de Oliva Clássico Gallo 250ml;R$ 23,65;Sim
Atacadão;Alimentos Básicos;Azeite de Oliva Extra Virgem Borges 500ml;R$ 37,69;Não
Atacadão;Alimentos Básicos;Azeite de Oliva Extra Virgem Clássico Espanhol Borges 250ml;R$ 18,25;Não
Atacadão;Alimentos Básicos;Azeite de Oliva Gallo Reserva 500ml;R$ 52,81;Não
Atacadão;Alimentos Básicos;Azeite de Oliva Gallo Único 250ml;R$ 23,65;Sim
Atacadão;Alimentos Básicos;Azeite de Oliva Português Andorinha Extra Virgem 500ml;R$ 45,25;Não
Atacadão;Alimentos Básicos;Azeite de Oliva Tipo Único Brasileiro Original Borges 500ml;R$ 34,45;Não
Atacadão;Alimentos Básicos;Açucar Refinado União Fit Light 500g;R$ 5,92;Não
Atacadão;Alimentos Básicos;Açúcar Cristal Vida 1kg;R$ 3,87;Não
Atacadão;Alimentos Básicos;Açúcar Cristal Agrovale 1kg;R$ 3,61;Sim
Atacadão;Alimentos Básicos;Açúcar Cristal Marata Sachê 4g Caixa Com 400un;R$ 21,49;Não
Atacadão;Alimentos Básicos;Açúcar Cristal Orgânico União 1kg;R$ 9,60;Não
Atacadão;Alimentos Básicos;Açúcar Demerara Agrovale 1kg;R$ 4,41;Sim
Atacadão;Alimentos Básicos;Açúcar Demerara Naturale União 1kg;R$ 9,27;Não
Atacadão;Alimentos Básicos;Açúcar Demerara União 1kg;R$ 7,00;Sim
Atacadão;Alimentos Básicos;Açúcar Mascavo Kicaldo Embalagem 1kg;R$ 12,42;Não
Atacadão;Alimentos Básicos;Açúcar Mascavo Natural Life 500g;R$ 11,77;Não
Atacadão;Alimentos Básicos;Açúcar Mascavo Natus Pacote 1kg;R$ 12,85;Não
Atacadão;Alimentos Básicos;Açúcar Mascavo União 1kg;R$ 25,81;Não
Atacadão;Alimentos Básicos;Açúcar Mascavo União 400g;R$ 11,77;Não
Atacadão;Alimentos Básicos;Açúcar Refinado União Premium Sachês 5g Caixa Com 400un;R$ 26,89;Não
Atacadão;Alimentos Básicos;Canjica Amarela Yoki 500g;R$ 8,19;Sim
Atacadão;Alimentos Básicos;Canjica Branca Marata 400g;R$ 4,84;Não
Atacadão;Alimentos Básicos;Canjica de Milho Amarelo para Munguzá Maratá 400g;R$ 3,76;Não
Atacadão;Alimentos Básicos;Canjica de Milho Branca Tipo 1 Cristal Yoki 400g;R$ 7,00;Sim
Atacadão;Alimentos Básicos;Canjica de Milho Branco Dular 500g;R$ 5,28;Sim
Atacadão;Alimentos Básicos;Canjica de Milho Coringa 200g;R$ 4,30;Não
Atacadão;Alimentos Básicos;Canjiquinha São Braz 400g;R$ 12,84;Não
Atacadão;Alimentos Básicos;Cr Manga Brasfrut 1,02kg;R$ 19,33;Não
Atacadão;Alimentos Básicos;Creme de Cebola Qualimax Embalagem 1,01kg;R$ 40,50;Não
Atacadão;Alimentos Básicos;Cup Noodles Galinha Caipira Nissin 69g;R$ 4,63;Sim
Atacadão;Alimentos Básicos;Cuscuz Vitamilho Embalagem 500g;R$ 1,60;Sim
Atacadão;Alimentos Básicos;Farinha Amarela;R$ 7,11;Sim
Atacadão;Alimentos Básicos;Farinha De Mandioca 1kg;R$ 6,03;Não
Atacadão;Alimentos Básicos;Farinha Finna - de Trigo com Fermento;R$ 4,91;Sim
Atacadão;Alimentos Básicos;Farinha Imperial Branca 1kg;R$ 3,76;Não
Atacadão;Alimentos Básicos;Farinha Mandioca Bellanovo Branca 1kg;R$ 3,76;Sim
Atacadão;Alimentos Básicos;Farinha Mandioca Branca Fina Nossa Farinha 1kg;R$ 3,66;Não
Atacadão;Alimentos Básicos;Farinha Mandioca da Feira 1kg;R$ 6,03;Sim
Atacadão;Alimentos Básicos;Farinha Trigo Diamante Papel 25kg;R$ 90,72;Não
Atacadão;Alimentos Básicos;Farinha Trigo Dona Benta Pizza 5kg;R$ 21,49;Sim
Atacadão;Alimentos Básicos;Farinha Trigo Pastel Dona Benta 5kg;R$ 21,49;Não
Atacadão;Alimentos Básicos;Farinha de Arroz Tio João Pacote 1kg;R$ 8,08;Sim
Atacadão;Alimentos Básicos;Farinha de Arroz Urbano 1kg;R$ 7,54;Sim
Atacadão;Alimentos Básicos;Farinha de Linhaça Marrom Tia Sonia Embalagem 200g;R$ 8,10;Não
Atacadão;Alimentos Básicos;Farinha de Linhaça Natu's 200g;R$ 8,53;Não
Atacadão;Alimentos Básicos;Farinha de Mandioca Branca Belladona 1kg;R$ 8,52;Sim
Atacadão;Alimentos Básicos;Farinha de Mandioca Fina Branca Daboa 1kg;R$ 5,71;Não
Atacadão;Alimentos Básicos;Farinha de Milho Cuscuz Coringa 500g;R$ 1,27;Sim
Atacadão;Alimentos Básicos;Farinha de Milho Flocada Cuscuz Maratá 500g;R$ 1,50;Sim
Atacadão;Alimentos Básicos;Farinha de Milho Flocão Coringa 500g;R$ 2,14;Sim
Atacadão;Alimentos Básicos;Farinha de Milho Maratá Flocão Embalagem 500g;R$ 1,89;Sim
Atacadão;Alimentos Básicos;Farinha de Rosca Dular 500g;R$ 7,00;Sim
Atacadão;Alimentos Básicos;Farinha de Rosca Yoki 500g;R$ 11,32;Não
Atacadão;Alimentos Básicos;Farinha de Rosca Yoki Pacote 4kg;R$ 48,04;Não
Atacadão;Alimentos Básicos;Farinha de Trigo Dona Maria Embalagem 1kg;R$ 4,20;Não
Atacadão;Alimentos Básicos;Farinha de Trigo Dona Maria Especial Pizza e Croissant 5kg;R$ 23,65;Não
Atacadão;Alimentos Básicos;Farinha de Trigo Dona Maria Pastéis Embalagem 5kg;R$ 24,73;Não
Atacadão;Alimentos Básicos;Farinha de Trigo Finna 1kg;R$ 4,37;Sim
Atacadão;Alimentos Básicos;Farinha de Trigo Finna Tipo 1 1kg;R$ 4,37;Não
Atacadão;Alimentos Básicos;Farinha de Trigo Finna com Fermento Papel 1kg;R$ 5,06;Não
Atacadão;Alimentos Básicos;Farinha de Trigo Pizza Suprema 5kg;R$ 23,65;Não
Atacadão;Alimentos Básicos;Farinha de Trigo Reserva Especial Dona Benta 1kg;R$ 5,38;Não
Atacadão;Alimentos Básicos;Farinha de Trigo Suprema Embalagem 1kg;R$ 105,73;Não
Atacadão;Alimentos Básicos;Farinha de Trigo Tradicional Dona Benta 1kg;R$ 4,63;Sim
Atacadão;Alimentos Básicos;Farinha de Trigo Tradicional Tipo 1 Brandini 1kg;R$ 3,98;Sim
Atacadão;Alimentos Básicos;Farinha de Trigo Tradicional Tipo 1 Dona Maria 1kg;R$ 106,81;Não
Atacadão;Alimentos Básicos;Farinha de Trigo com Fermento Brandini 1kg;R$ 4,63;Não
Atacadão;Alimentos Básicos;Farinha de Trigo com Fermento Dona Maria 1kg;R$ 4,74;Não
Atacadão;Alimentos Básicos;Farinha de Trigo para Pizza Dona Benta Especialidades 1kg;R$ 3,98;Não
Atacadão;Alimentos Básicos;Farofa de Mandioca Tradicional Yoki Pacote 400g;R$ 12,85;Não
Atacadão;Alimentos Básicos;Feijao Rajado Dular 1kg;R$ 15,97;Não
Atacadão;Alimentos Básicos;Feijoada Bordon 430g;R$ 11,34;Não
Atacadão;Alimentos Básicos;Feijão Bi Bom 1kg;R$ 4,41;Não
Atacadão;Alimentos Básicos;Feijão Branco Dular 1kg;R$ 18,25;Não
Atacadão;Alimentos Básicos;Feijão Branco Dular 500g;R$ 10,26;Sim
Atacadão;Alimentos Básicos;Feijão Branco Kicaldo 1kg;R$ 21,04;Não
Atacadão;Alimentos Básicos;Feijão Branco Kicaldo 500g;R$ 9,61;Não
Atacadão;Alimentos Básicos;Feijão Branco Tipo 1 Camil 500g;R$ 10,69;Não
Atacadão;Alimentos Básicos;Feijão Carioca Baiano 1kg;R$ 5,02;Não
Atacadão;Alimentos Básicos;Feijão Carioca Pronto Camil 380g;R$ 7,65;Não
Atacadão;Alimentos Básicos;Feijão Carioca Tio Neco 1kg;R$ 6,25;Sim
Atacadão;Alimentos Básicos;Feijão Carioca Tipo 1 Kicaldo 1kg;R$ 7,98;Sim
Atacadão;Alimentos Básicos;Feijão Carioca Toda Vida Embalagem 1kg;R$ 5,28;Não
Atacadão;Alimentos Básicos;Feijão Carioca Vale Bahia 1kg;R$ 5,60;Não
Atacadão;Alimentos Básicos;Feijão Carioca Vida 1kg;R$ 6,77;Não
Atacadão;Alimentos Básicos;Feijão Carioca da Patroa 1kg;R$ 5,71;Não
Atacadão;Alimentos Básicos;Feijão Corda Cordan 1kg;R$ 6,79;Não
Atacadão;Alimentos Básicos;Feijão Fradinho Dular 1kg;R$ 7,29;Não
Atacadão;Alimentos Básicos;Feijão Fradinho Kicaldo 500g;R$ 4,30;Sim
Atacadão;Alimentos Básicos;Feijão Fradinho Kicaldo Embalagem 1kg;R$ 8,62;Não
Atacadão;Alimentos Básicos;Feijão Manolinho 1kg;R$ 7,33;Não
Atacadão;Alimentos Básicos;Feijão Manolinho Fradinho 1kg;R$ 6,57;Não
Atacadão;Alimentos Básicos;Feijão Preto Dular 1kg;R$ 6,46;Não
Atacadão;Alimentos Básicos;Feijão Preto Fugini 250g;R$ 5,28;Não
Atacadão;Alimentos Básicos;Feijão Preto Imperial 1kg;R$ 6,79;Não
Atacadão;Alimentos Básicos;Feijão Preto Manolinho Embalagem 1kg;R$ 6,64;Não
Atacadão;Alimentos Básicos;Feijão Preto Pronto Bonare Sachê;R$ 3,98;Não
Atacadão;Alimentos Básicos;Feijão Preto Pronto Temperado e Cozido Camil 380g;R$ 7,54;Não
Atacadão;Alimentos Básicos;Feijão Preto Tipo 1 Kicaldo 1kg;R$ 6,96;Sim
Atacadão;Alimentos Básicos;Feijão Rajado Kicaldo Tipo 1 1kg;R$ 18,88;Não
Atacadão;Alimentos Básicos;Feijão Vermelho Kicaldo 1kg;R$ 21,49;Não
Atacadão;Alimentos Básicos;Fermento em Pó Fermix Biologico Dona Benta Sachê 10g;R$ 1,39;Sim
Atacadão;Alimentos Básicos;Fermento em Pó Quimico Tradicional Dona Benta 100g;R$ 3,55;Sim
Atacadão;Alimentos Básicos;Flocao Bonomilho Nao Transgenico;R$ 3,87;Não
Atacadão;Alimentos Básicos;Flocos de Milho Bonomilho Cuscuz Embalagem 500g;R$ 1,99;Não
Atacadão;Alimentos Básicos;Flocão De Milho Gota 400g;R$ 1,39;Não
Atacadão;Alimentos Básicos;Flocão Fibras de Arroz Coringa Embalagem 200g;R$ 3,01;Não
Atacadão;Alimentos Básicos;Flocão Nordestino Embalagem 500g;R$ 1,67;Sim
Atacadão;Alimentos Básicos;Flocão de Arroz Coringa 500g;R$ 4,20;Sim
Atacadão;Alimentos Básicos;Flocão de Milho Bonomilho 500g;R$ 1,60;Não
Atacadão;Alimentos Básicos;Flocão de Milho Coringa Fibras Embalagem 200g;R$ 1,82;Não
Atacadão;Alimentos Básicos;Flocão de Milho Flokão Pacote 400g;R$ 1,39;Não
Atacadão;Alimentos Básicos;Flocão de Milho sem Glúten Vitamilho Pacote 500g;R$ 1,39;Sim
Atacadão;Alimentos Básicos;Fubá Mimoso Yoki 500g;R$ 4,20;Sim
Atacadão;Alimentos Básicos;Fubá Mimoso Yoki Pacote 1kg;R$ 5,38;Não
Atacadão;Alimentos Básicos;Fubá de Milho Mimoso Yoki Pacote 4kg;R$ 31,21;Não
Atacadão;Alimentos Básicos;Goma Fresca Sinhá Maria 1kg;R$ 8,04;Não
Atacadão;Alimentos Básicos;Grão de Bico Dular 500g;R$ 12,79;Não
Atacadão;Alimentos Básicos;Grão de Bico Kicaldo 500g;R$ 8,58;Não
Atacadão;Alimentos Básicos;Grão de Bico Pronto Camil 380g;R$ 7,00;Sim
Atacadão;Alimentos Básicos;Grão-de-bico Yoki Pacote 400g;R$ 10,74;Sim
Atacadão;Alimentos Básicos;Lentilha Kicaldo 500g;R$ 11,32;Não
Atacadão;Alimentos Básicos;Lentilha Yoki 400g;R$ 11,77;Sim
Atacadão;Alimentos Básicos;Mac.Dona Benta Caseiro Talharim N2 500g;R$ 7,87;Não
Atacadão;Alimentos Básicos;Macarrao Instantâneo Galinha Vitarella 74,3g;R$ 1,13;Sim
Atacadão;Alimentos Básicos;Macarrao Marata Inst Costela 74g;R$ 1,02;Sim
Atacadão;Alimentos Básicos;Macarrao Marata Inst Galinha 74g;R$ 1,02;Sim
Atacadão;Alimentos Básicos;Macarrao Penne Gran Duro Petybon 500g;R$ 8,62;Não
Atacadão;Alimentos Básicos;Macarrão Com Ovos Ave Maria Petybon 500g;R$ 5,71;Não
Atacadão;Alimentos Básicos;Macarrão Cup Noodles 68g Inst Qjo Nacho;R$ 4,63;Não
Atacadão;Alimentos Básicos;Macarrão Espaguete Fettuccine Speciale Vitarella 400g;R$ 4,09;Sim
Atacadão;Alimentos Básicos;Macarrão Espaguete Fino Lili 400g;R$ 2,10;Não
Atacadão;Alimentos Básicos;Macarrão Espaguete Fino Pilar 400g;R$ 2,58;Sim
Atacadão;Alimentos Básicos;Macarrão Espaguete Integral Grano Duro Petybon 500g;R$ 8,62;Não
Atacadão;Alimentos Básicos;Macarrão Espaguete Massa Tradicional N8 Brandini 500g;R$ 3,44;Sim
Atacadão;Alimentos Básicos;Macarrão Espaguete Sêmola Dona Benta 500g;R$ 4,30;Sim
Atacadão;Alimentos Básicos;Macarrão Espaguete Tradicional Predilleto 400g;R$ 2,68;Não
Atacadão;Alimentos Básicos;Macarrão Espaguete com Ovos N8 Dona Benta 500g;R$ 4,84;Sim
Atacadão;Alimentos Básicos;Macarrão Espaguete de Arroz Integral sem Glúten Urbano 500g;R$ 6,46;Sim
