mercado;categoria;produto;preco;produto_nos_dois
Atakarejo;Limpeza;Ala Dt Po Erva Doce E Bicarb 16x800g;R$ 6,80;Sim
Atakarejo;Limpeza;Alcool Coperalcool Bac 46º Class 500ml;R$ 7,10;Sim
Atakarejo;Limpeza;Alcool Coperalcool Liquido Tradicional 46 Inpm 1lt;R$ 12,40;Sim
Atakarejo;Limpeza;Alcool Coperalcool em Gel Clássico 70 Inpm 500g;R$ 9,26;Sim
Atakarejo;Limpeza;Alcool Zumbi Liquido Tradicional 46 Inpm 1 Lt;R$ 10,66;Sim
Atakarejo;Limpeza;Alvejante 3 em 1 com Cloro Brilux Multi Frasco 500ml;R$ 2,35;Não
Atakarejo;Limpeza;Alvejante Brilux Embalagem 1l;R$ 4,45;Sim
Atakarejo;Limpeza;Alvejante Brilux Perfumado Lavanda Embalagem 1l;R$ 3,58;Não
Atakarejo;Limpeza;Alvejante Lavanda Brilux 2l;R$ 7,10;Não
Atakarejo;Limpeza;Alvejante Multiuso Dragão 1l;R$ 3,30;Sim
Atakarejo;Limpeza;Alvejante Perfumado Brilux Fresh Embalagem 1l;R$ 3,58;Não
Atakarejo;Limpeza;Alvejante Perfumado Brilux com Detergente Embalagem Leve 5 Litros Pague 4,5 Litros;R$ 20,05;Sim
Atakarejo;Limpeza;Alvejante Perfumado Floral Brilux 1l;R$ 3,58;Não
Atakarejo;Limpeza;Alvejante Qboa Floral 1l;R$ 4,09;Não
Atakarejo;Limpeza;Alvejante Qboa Lavanda 1l;R$ 4,09;Sim
Atakarejo;Limpeza;Alvejante Qboa Plus 3em1 1l;R$ 4,09;Não
Atakarejo;Limpeza;Alvejante Teiú 3em1 com Detergente 1 Litro;R$ 2,68;Não
Atakarejo;Limpeza;Alvejante Ypê Flores da Primavera 1l;R$ 4,72;Não
Atakarejo;Limpeza;Amaciante Azul Tradicional Comfort 3l;R$ 29,88;Sim
Atakarejo;Limpeza;Amaciante Comfort Concentrado Frescor Intenso 500ml;R$ 9,65;Sim
Atakarejo;Limpeza;Amaciante Concentrado Brisa Intenso Downy 1l;R$ 28,86;Não
Atakarejo;Limpeza;Amaciante Concentrado Brisa Intenso Downy 750ml;R$ 13,15;Não
Atakarejo;Limpeza;Amaciante Concentrado Brisa de Verão Downy 1l;R$ 28,86;Sim
Atakarejo;Limpeza;Amaciante Concentrado Cuidado Intensivo Comfort Refil 900ml;R$ 20,38;Sim
Atakarejo;Limpeza;Amaciante Concentrado Downy Lírios do Campo 1,5l;R$ 23,68;Sim
Atakarejo;Limpeza;Amaciante Concentrado Expert Care Hydra Sérum Comfort 500ml;R$ 12,09;Sim
Atakarejo;Limpeza;Amaciante Concentrado Frescor da Primavera Downy 500ml;R$ 11,42;Sim
Atakarejo;Limpeza;Amaciante Concentrado Perfume de Outono Brilux 500ml;R$ 8,16;Sim
Atakarejo;Limpeza;Amaciante Concentrado Puro Cuidado Comfort Refil 900ml;R$ 20,38;Não
Atakarejo;Limpeza;Amaciante Concentrado Seiva De Alfazema Downy 1,5l;R$ 31,16;Sim
Atakarejo;Limpeza;Amaciante Concentrado Tradicional Fofo 1,5l;R$ 24,88;Sim
Atakarejo;Limpeza;Amaciante Concentrado para Roupas Azul Tudão Fofo 500ml;R$ 9,19;Sim
Atakarejo;Limpeza;Amaciante De Roupas Sense Sport Intenso 500ml Qboa;R$ 3,09;Não
Atakarejo;Limpeza;Amaciante Downy Brisa do Verão 500ml;R$ 10,98;Sim
Atakarejo;Limpeza;Amaciante Downy Lirios do Campo 500ml;R$ 11,42;Sim
Atakarejo;Limpeza;Amaciante Intenso Ypê 2l;R$ 13,28;Sim
Atakarejo;Limpeza;Amaciante Mais Frescor Mon Bijou 1,7l;R$ 11,08;Não
Atakarejo;Limpeza;Amaciante Qboa Carinho 500ml;R$ 2,98;Sim
Atakarejo;Limpeza;Amaciante Qboa Maciez com Ternura 500ml;R$ 2,98;Não
Atakarejo;Limpeza;Amaciante Qboa Ternura 2l;R$ 10,38;Não
Atakarejo;Limpeza;Amaciante Sonho Azul Profundo Embalagem 1,5l;R$ 9,46;Não
Atakarejo;Limpeza;Amaciante Sonho Lavanda Embalagem 1,5l;R$ 9,46;Não
Atakarejo;Limpeza;Amaciante Sonho Magic Embalagem 5 Litros;R$ 29,96;Não
Atakarejo;Limpeza;Amaciante Sonho Paixão Pet 1,5 Litro;R$ 9,46;Não
Atakarejo;Limpeza;Amaciante Teiu Azul Carinho Embalagem 2 Litros;R$ 9,69;Sim
Atakarejo;Limpeza;Amaciante Ternura Ekobom 5l;R$ 15,79;Não
Atakarejo;Limpeza;Amaciante de Roupa + Perfume Mon Bijou 1,7l;R$ 11,08;Sim
Atakarejo;Limpeza;Amaciante de Roupa Aconchego Ypê Frasco 500ml;R$ 4,30;Sim
Atakarejo;Limpeza;Amaciante de Roupa Carinho Qboa 2l;R$ 10,38;Sim
Atakarejo;Limpeza;Amaciante de Roupa Concentrado 48 Segredos Comfort 500ml;R$ 13,19;Não
Atakarejo;Limpeza;Amaciante de Roupa Concentrado Amarelo Chamego Fofo 500ml;R$ 9,19;Não
Atakarejo;Limpeza;Amaciante de Roupa Concentrado Brisa Intenso Downy 1,5l;R$ 23,68;Sim
Atakarejo;Limpeza;Amaciante de Roupa Concentrado Brisa Intenso Downy 500ml;R$ 11,42;Sim
Atakarejo;Limpeza;Amaciante de Roupa Concentrado Brisa Suave Downy 1,5l;R$ 23,68;Sim
Atakarejo;Limpeza;Amaciante de Roupa Concentrado Brisa Suave Downy 500ml;R$ 11,42;Sim
Atakarejo;Limpeza;Amaciante de Roupa Concentrado Collection Místico Downy 450ml;R$ 15,18;Sim
Atakarejo;Limpeza;Amaciante de Roupa Concentrado Fiber Protect Cuidado Intensivo Comfort 500ml;R$ 12,09;Não
Atakarejo;Limpeza;Amaciante de Roupa Concentrado Laranja Vitorioso Fofo 500ml;R$ 9,19;Não
Atakarejo;Limpeza;Amaciante de Roupa Concentrado Lírios do Campo Downy Refil 1,6l;R$ 23,68;Sim
Atakarejo;Limpeza;Amaciante de Roupa Concentrado Refil Azul Tudão Fofo 900ml;R$ 14,55;Não
Atakarejo;Limpeza;Amaciante de Roupa Concentrado de Lavanda Embalagem Econômica Comfort 1,5l;R$ 32,30;Não
Atakarejo;Limpeza;Amaciante de Roupa Diluído Aconchego Ypê 5l;R$ 27,29;Não
Atakarejo;Limpeza;Amaciante de Roupa Diluído Ternura;R$ 13,28;Sim
Atakarejo;Limpeza;Amaciante de Roupa Jardim Perfumado Atol 1,6l;R$ 6,58;Não
Atakarejo;Limpeza;Amaciante de Roupa Magic Sonho 1,5l;R$ 9,46;Não
Atakarejo;Limpeza;Amaciante de Roupa Mon Bijou Pureza +Perfume Bombril 500ml;R$ 3,98;Não
Atakarejo;Limpeza;Amaciante de Roupa Proteção Mon Bijou Bombril 500ml;R$ 3,98;Sim
Atakarejo;Limpeza;Amaciante de Roupas Clássico Ekobom 2l;R$ 8,85;Não
Atakarejo;Limpeza;Amaciante de Roupas Concentrado Azul Splendor Tuff 1l;R$ 15,46;Não
Atakarejo;Limpeza;Amaciante de Roupas Concentrado Downy Alfazema e Lavanda 500ml;R$ 15,18;Sim
Atakarejo;Limpeza;Amaciante de Roupas Concentrado Frescor de Verão Brilux 500ml;R$ 8,16;Sim
Atakarejo;Limpeza;Amaciante de Roupas Diluido Sensações Invicto 2l;R$ 6,85;Não
Atakarejo;Limpeza;Amaciante de Roupas Puff Raio de Sol 1,5l Eco;R$ 9,75;Não
Atakarejo;Limpeza;Amaciante de Roupas Ternura Ekobom 2l;R$ 8,85;Não
Atakarejo;Limpeza;Amaciante para Roupas Sedução Intensa Invicto 1,8l;R$ 6,85;Não
Atakarejo;Limpeza;Amaciante para Roupas de Bebê Vida Macia Amêndoas Embalagem 500ml;R$ 6,85;Sim
Atakarejo;Limpeza;Amaciante para Roupinhas de Bebê Vida Macia Camomila 500ml;R$ 6,85;Não
Atakarejo;Limpeza;Aromatizador Bom Ar Campos de Lavanda 360ml;R$ 18,26;Sim
Atakarejo;Limpeza;Bacia Canelada Branca Plasvale 4,6l;R$ 9,85;Não
Atakarejo;Limpeza;Bacia Canelada Ref.354 Plasvale 1,3l;R$ 20,95;Não
Atakarejo;Limpeza;Bacia Plástica Canelada Plasvale 2,5l;R$ 6,49;Não
Atakarejo;Limpeza;Balde Plasvale 8l;R$ 24,30;Não
Atakarejo;Limpeza;Bloco Sanitário para Caixa Acoplada Pinho Harpic;R$ 19,10;Sim
Atakarejo;Limpeza;Brilha Móveis Lavanda Destac 200ml;R$ 10,08;Não
Atakarejo;Limpeza;Cera Líquida Polylar Para Pisos 750ml - Verde;R$ 7,46;Não
Atakarejo;Limpeza;Cera Líquida Vermelha Polylar 750ml;R$ 7,46;Não
Atakarejo;Limpeza;Cif Cremoso Multiuso Limpeza Milagrosa Floral Rosas E Jasmim 450ml;R$ 21,49;Sim
Atakarejo;Limpeza;Desengordurante Cif Ultra Rápido Original 500ml;R$ 21,68;Sim
Atakarejo;Limpeza;Desengordurante Qboa Cozinha 500ml;R$ 6,00;Sim
Atakarejo;Limpeza;Desengordurante Veja Cozinha Limão Refil Econômico 400ml;R$ 10,36;Sim
Atakarejo;Limpeza;Desinf Pinho Bril Flores Limao 500ml;R$ 6,55;Não
Atakarejo;Limpeza;Desinfetante Antibac Flor e Frutas Vermelhas 10% Desconto Uau 2l;R$ 12,58;Não
Atakarejo;Limpeza;Desinfetante Bak Lavanda Ypê 500ml;R$ 3,60;Não
Atakarejo;Limpeza;Desinfetante Bak Turquesa Bak Squeeze Ypê 500ml;R$ 3,60;Não
Atakarejo;Limpeza;Desinfetante Bak de Eucalipto Ypê 2l;R$ 11,40;Sim
Atakarejo;Limpeza;Desinfetante Bombril Kalipto Pinho Embalagem 750ml;R$ 4,55;Não
Atakarejo;Limpeza;Desinfetante Campestre Dragão 5l;R$ 15,28;Não
Atakarejo;Limpeza;Desinfetante Campos Lavanda Pinho Bril 500ml;R$ 6,55;Sim
Atakarejo;Limpeza;Desinfetante Campos de Lavanda Pinho Bril 1l;R$ 11,75;Sim
Atakarejo;Limpeza;Desinfetante Cif Antibac 500ml Squeeze;R$ 7,55;Não
Atakarejo;Limpeza;Desinfetante Dragão Campestre Embalagem 2 Litros;R$ 5,18;Sim
Atakarejo;Limpeza;Desinfetante Dragão Floral 5 Litros;R$ 13,69;Sim
Atakarejo;Limpeza;Desinfetante Dragão Lavanda Embalagem 2 Litros;R$ 5,36;Não
Atakarejo;Limpeza;Desinfetante Floral Dragão 2l;R$ 5,36;Sim
Atakarejo;Limpeza;Desinfetante Floral Teiú 1l;R$ 4,80;Não
Atakarejo;Limpeza;Desinfetante Kalipto Lavanda Lev 2l Pague 1,9l;R$ 10,55;Não
Atakarejo;Limpeza;Desinfetante Lavanda Dragão 5l;R$ 13,69;Sim
Atakarejo;Limpeza;Desinfetante Lavanda Kalipto 750ml;R$ 4,55;Não
Atakarejo;Limpeza;Desinfetante Lavanda Pinho Urca 2l;R$ 6,22;Não
Atakarejo;Limpeza;Desinfetante Lisa Eucalipto 500ml;R$ 2,30;Sim
Atakarejo;Limpeza;Desinfetante Lisa Lavanda 500ml;R$ 2,30;Sim
Atakarejo;Limpeza;Desinfetante Lisa Pinho Marine 500ml;R$ 2,30;Não
Atakarejo;Limpeza;Desinfetante Minuano Floral 500ml;R$ 2,96;Não
Atakarejo;Limpeza;Desinfetante Minuano Herbal 500ml;R$ 2,96;Não
Atakarejo;Limpeza;Desinfetante Minuano Lavanda 500ml;R$ 2,96;Não
Atakarejo;Limpeza;Desinfetante Original Pinho Sol 500ml;R$ 7,65;Sim
Atakarejo;Limpeza;Desinfetante Perfumado Cordel de Flores Atol 90ml;R$ 5,00;Não
Atakarejo;Limpeza;Desinfetante Perfumado Lavanda Pinho Sol Com 500ml;R$ 6,81;Não
Atakarejo;Limpeza;Desinfetante Pinho Bril Bombril 1l;R$ 10,79;Não
Atakarejo;Limpeza;Desinfetante Pinho Bril Brisa do Mar 1000ml;R$ 11,75;Não
Atakarejo;Limpeza;Desinfetante Pinho Lisa 2l;R$ 5,76;Não
Atakarejo;Limpeza;Desinfetante Pinho Sol Original 1l;R$ 12,98;Sim
Atakarejo;Limpeza;Desinfetante Pinho Ypê Lavanda 500ml;R$ 5,56;Sim
Atakarejo;Limpeza;Desinfetante Pinho Ypê Tradição 500ml;R$ 5,56;Sim
Atakarejo;Limpeza;Desinfetante Radiante Jasmim 500ml;R$ 2,18;Não
Atakarejo;Limpeza;Desinfetante Radiante Lavanda 2 Litros;R$ 9,56;Não
Atakarejo;Limpeza;Desinfetante Radiante Lavanda 500ml;R$ 2,18;Não
Atakarejo;Limpeza;Desinfetante Sanitário Líquido Cloro Forte Harpic 500ml;R$ 14,64;Não
Atakarejo;Limpeza;Desinfetante Sanol Infusão de Rosas 2 Litros;R$ 7,48;Não
Atakarejo;Limpeza;Desinfetante Sanol Lavanda Embalagem 2l;R$ 7,48;Não
Atakarejo;Limpeza;Desinfetante Sanol Original 2l;R$ 7,48;Não
Atakarejo;Limpeza;Desinfetante Silvestre Pinho Bril 500ml;R$ 6,55;Sim
Atakarejo;Limpeza;Desinfetante Talco Sanol 2l;R$ 7,48;Não
Atakarejo;Limpeza;Desinfetante Teiu Citrus Embalagem 1l;R$ 4,80;Não
Atakarejo;Limpeza;Desinfetante Teiú Lavanda 1l;R$ 4,80;Sim
Atakarejo;Limpeza;Desinfetante Teiú Marine 1l;R$ 4,80;Não
Atakarejo;Limpeza;Desinfetante Ypê Bak Floral 1 Litro;R$ 6,54;Não
Atakarejo;Limpeza;Desinfetante Ypê Bak Floral 500ml;R$ 3,60;Não
Atakarejo;Limpeza;Desinfetante Ypê Bak Lavanda 1 Litro;R$ 6,54;Não
Atakarejo;Limpeza;Desinfetante de Uso Geral Pinho Tradição Ypê 2l;R$ 16,88;Não
Atakarejo;Limpeza;Desodorizador Sanitário Glade Pedra Bouquet de Lavanda 25g 25% Desconto;R$ 3,65;Não
Atakarejo;Limpeza;Desodorizador Sanitário Pastilha Adesiva Citrus 20% Desconto Pato 3un;R$ 6,58;Não
Atakarejo;Limpeza;Desodorizador Sanitário Pastilha Adesiva Floral Pato 3un 20% Desconto;R$ 6,58;Não
Atakarejo;Limpeza;Desodorizador Sanitário em Pastilha Adesiva Fresh Pato 3un;R$ 6,58;Sim
Atakarejo;Limpeza;Desodorizador Toque de Frescor Refil Lavanda Glade 12ml Leve 3 Pague 2;R$ 26,64;Não
Atakarejo;Limpeza;Desodorizador de Ambiente Automático Brisa Cítrica de Verão Glade 269ml;R$ 33,06;Não
Atakarejo;Limpeza;Detergente Atol Neutro 2l;R$ 9,30;Sim
Atakarejo;Limpeza;Detergente Atol Neutro 500ml;R$ 1,88;Não
Atakarejo;Limpeza;Detergente Clear Care Ypê 500ml;R$ 3,14;Não
Atakarejo;Limpeza;Detergente Clear Teiú 500ml;R$ 2,05;Sim
Atakarejo;Limpeza;Detergente Em Pó Espumil Flores 400g;R$ 1,50;Sim
Atakarejo;Limpeza;Detergente Em Pó Lavanda Espumil 400g;R$ 1,50;Sim
Atakarejo;Limpeza;Detergente Lava Louças Minuano 1300 Limão Líquido 500ml;R$ 2,68;Não
Atakarejo;Limpeza;Detergente Líquido Antibactericida Ypê 500ml;R$ 4,08;Não
Atakarejo;Limpeza;Detergente Líquido Brilux Coco Embalagem 500ml;R$ 1,99;Não
Atakarejo;Limpeza;Detergente Líquido Brilux com Vinagre Embalagem 500ml;R$ 2,36;Não
Atakarejo;Limpeza;Detergente Líquido Cristal Limpol 500ml;R$ 2,39;Sim
Atakarejo;Limpeza;Detergente Líquido Invicto Coco Embalagem 500ml;R$ 1,99;Não
Atakarejo;Limpeza;Detergente Líquido Invicto Limão Embalagem 500ml;R$ 1,99;Não
Atakarejo;Limpeza;Detergente Líquido Invicto Neutro 1,8 Litros;R$ 9,99;Não
Atakarejo;Limpeza;Detergente Líquido Invicto Neutro Embalagem 500ml;R$ 1,99;Não
Atakarejo;Limpeza;Detergente Líquido Izabella Limão 500ml;R$ 1,45;Não
Atakarejo;Limpeza;Detergente Líquido Izabella Maçã 500ml;R$ 1,45;Não
Atakarejo;Limpeza;Detergente Líquido Izabella Neutro 500ml;R$ 1,45;Não
Atakarejo;Limpeza;Detergente Líquido Lava Louça Minuano 1300 Maçã 500ml;R$ 2,68;Não
Atakarejo;Limpeza;Detergente Líquido Lava Louças Minuano 1300 Marine 500ml;R$ 2,68;Não
Atakarejo;Limpeza;Detergente Líquido Lava Louças Minuano Neutro 500ml;R$ 2,68;Não
Atakarejo;Limpeza;Detergente Líquido Lisa Limão Embalagem 500ml;R$ 1,86;Sim
Atakarejo;Limpeza;Detergente Líquido Lisa Neutro 500ml;R$ 1,86;Sim
Atakarejo;Limpeza;Detergente Líquido Neutro Teiú 2l;R$ 8,98;Sim
Atakarejo;Limpeza;Detergente Líquido Neutro Teiú 500ml;R$ 2,05;Sim
Atakarejo;Limpeza;Detergente Líquido Oriental Neutro 2 Litros;R$ 8,62;Não
Atakarejo;Limpeza;Detergente Líquido Teiu Neutro 5 Litros;R$ 20,58;Sim
Atakarejo;Limpeza;Detergente Líquido de Coco Limpol 500ml;R$ 2,39;Sim
Atakarejo;Limpeza;Detergente Líquido de Maçã Limpol 500ml;R$ 2,39;Não
Atakarejo;Limpeza;Detergente Micelar Minuano 500ml;R$ 2,68;Não
Atakarejo;Limpeza;Detergente Po Ala Lavanda;R$ 17,08;Sim
Atakarejo;Limpeza;Detergente Po Ala Lavanda;R$ 6,80;Sim
Atakarejo;Limpeza;Detergente Po Ala Rosas E Flor De Lis;R$ 6,80;Sim
Atakarejo;Limpeza;Detergente Sanitário Pedra Perfumada Bosque de Pinho Harpic 2un;R$ 6,70;Não
Atakarejo;Limpeza;Detergente Sanitário em Pedra Lavanda Pato Grátis 25% de Desconto;R$ 3,44;Não
Atakarejo;Limpeza;Detergente Teiú Limão 500ml;R$ 2,05;Sim
Atakarejo;Limpeza;Detergente Ypê Capim Limão 500ml;R$ 3,14;Sim
Atakarejo;Limpeza;Detergente Ypê Limão 500ml;R$ 3,14;Sim
Atakarejo;Limpeza;Detergente Ypê Maçã 500ml;R$ 3,14;Sim
Atakarejo;Limpeza;Detergente Ypê Neutro 500ml;R$ 3,14;Sim
Atakarejo;Limpeza;Detergente em Pó Maciez Tixan Ypê 1,6kg;R$ 23,19;Sim
Atakarejo;Limpeza;Detergente em Pó para Roupas Cuidado do Coco Ala 1,6kg;R$ 17,08;Sim
Atakarejo;Limpeza;Difusor de Aromas Frutas e Flores Vibrantes Glade 100ml;R$ 23,20;Sim
Atakarejo;Limpeza;Dispenser Click Preto Uz;R$ 20,35;Não
Atakarejo;Limpeza;Escova Bettanin Rec Rec Cozinha Noviça;R$ 9,12;Não
Atakarejo;Limpeza;Escova Noviça Bettajeans 1un;R$ 9,68;Sim
Atakarejo;Limpeza;Escova Noviça Limpeza Delicada 1un;R$ 6,24;Não
Atakarejo;Limpeza;Escova de Lavar Oval Condor;R$ 4,99;Não
Atakarejo;Limpeza;Esponja Azul Antiaderente Limppano;R$ 3,05;Não
Atakarejo;Limpeza;Esponja Azul de Limpeza Delicada Não Risca Brilhus 3un;R$ 3,96;Não
Atakarejo;Limpeza;Esponja Bombril Multiuso Oferta 4un;R$ 4,88;Sim
Atakarejo;Limpeza;Esponja Brilhus Dupla Face Oferta 4 Unidades;R$ 3,58;Sim
Atakarejo;Limpeza;Esponja Brilhus Não Risca Bettanin;R$ 0,95;Não
Atakarejo;Limpeza;Esponja Esfrebom Protege Unhas 3 Un;R$ 9,50;Não
Atakarejo;Limpeza;Esponja Laranja Não Risca Louças Delicadas Antibac Scotch Brite 3un;R$ 6,80;Sim
Atakarejo;Limpeza;Esponja Limppano Multiuso Embalagem Leve 4 Pague 3;R$ 5,82;Não
Atakarejo;Limpeza;Esponja Multiuso Ekobom;R$ 1,49;Não
Atakarejo;Limpeza;Esponja Multiuso Ekobom 4un;R$ 4,44;Não
Atakarejo;Limpeza;Esponja Multiuso Esfrebom Leve 4 Pague 3un;R$ 5,48;Sim
Atakarejo;Limpeza;Esponja Multiuso Limpaki Condor 1un;R$ 0,95;Não
Atakarejo;Limpeza;Esponja Multiuso Limpaki Leve 4 Pague 3 Condor Embalagem 4 Unidades;R$ 3,28;Não
Atakarejo;Limpeza;Esponja Multiuso Santa Maria Esfrelux;R$ 1,95;Não
Atakarejo;Limpeza;Esponja Multiuso Wish C/ 1un;R$ 0,75;Não
Atakarejo;Limpeza;Esponja Rayum Un Multiuso Limppano;R$ 7,45;Não
Atakarejo;Limpeza;Esponja Santa Maria Esfrelux Protetor de Unhas Embalagem 3 Un;R$ 6,49;Não
Atakarejo;Limpeza;Esponja Scotch-Brite Extrema 1 Un;R$ 2,38;Sim
Atakarejo;Limpeza;Esponja Super Wish Multiuso Leve 4 Un;R$ 3,22;Não
Atakarejo;Limpeza;Esponja Verde Multiuso Limpeza Abrasiva Limppano Maxxi 3 Unidades;R$ 9,35;Não
Atakarejo;Limpeza;Esponja com Formato de Unha Esfrelux;R$ 2,60;Não
Atakarejo;Limpeza;Esponja de Aço Bombril 60g;R$ 2,48;Sim
Atakarejo;Limpeza;Esponja de Aço Q'lustro 6un 40g;R$ 1,75;Sim
Atakarejo;Limpeza;Esponja de Limpeza Multiuso Scotch-brite Leve 4 Pague 3;R$ 7,40;Sim
Atakarejo;Limpeza;Flanela Alklin 33x53cm 1un;R$ 4,60;Não
Atakarejo;Limpeza;Flanela de Limpeza Dona Julia 30cm x 60cm;R$ 5,10;Não
Atakarejo;Limpeza;Gel Adesivo Sanitário Citrus Refil Pato 6un;R$ 16,26;Não
Atakarejo;Limpeza;Inseticida Aerosol Ação Total Baygon 360ml;R$ 12,49;Sim
Atakarejo;Limpeza;Inseticida Aerosol Ação Total Óleo de Eucalipto Baygon 360ml;R$ 12,49;Sim
Atakarejo;Limpeza;Inseticida Aerossol Multi-Insetos Base Água Óleo de Eucalipto Raid 420ml;R$ 14,99;Não
Atakarejo;Limpeza;Inseticida Aerossol Sbp Multi 380ml Embalagem Econômica;R$ 18,12;Sim
Atakarejo;Limpeza;Inseticida Aerossol sem Cheiro Noites Tranquilas Sbp 360ml;R$ 18,12;Não
Atakarejo;Limpeza;Inseticida Aerossol Óleo de Citronela Sbp Multi 380ml Embalagem Econômica;R$ 18,12;Sim
Atakarejo;Limpeza;Inseticida Aerossol Óleo de Eucalipto Sbp Multi Embalagem Econômica 380ml;R$ 18,12;Sim
Atakarejo;Limpeza;Inseticida Ação Total Raid 360ml;R$ 18,70;Sim
Atakarejo;Limpeza;Inseticida Iscas Mata Baratas Baygon com 6un;R$ 33,12;Sim
Atakarejo;Limpeza;Inseticida Pro Aerossol Mortein 360ml;R$ 16,80;Não
Atakarejo;Limpeza;Inseticida Proinset Aerosol sem Cheiro 350ml;R$ 11,88;Não
Atakarejo;Limpeza;Inseticida e Repelente Multi Insetos Base Água Aerosol Raid 420ml;R$ 14,99;Não
Atakarejo;Limpeza;Kit Econômico Cozinha Azulim Limpa + 3x500ml;R$ 14,59;Não
Atakarejo;Limpeza;Kit Repelente Elétrico Líquido 45 Noites 50% Grátis 2ª Unidade 35ml Sbp;R$ 24,28;Não
Atakarejo;Limpeza;Kit Tira Manchas Gel Multiuso 1,2l + Crystal White Vanish 1,2l;R$ 37,05;Não
Atakarejo;Limpeza;Kit Veja Multiuso Original 4 Unidades 500ml;R$ 19,45;Não
Atakarejo;Limpeza;Lava Loucas Polial Coco 2l;R$ 8,32;Não
Atakarejo;Limpeza;Lava Louça Atol Coco 2l;R$ 9,30;Não
Atakarejo;Limpeza;Lava Louça Atol Coco 500ml;R$ 1,88;Não
Atakarejo;Limpeza;Lava Louça Atol Limão 2l;R$ 9,30;Não
Atakarejo;Limpeza;Lava Louça Atol Limão 500ml;R$ 1,88;Não
Atakarejo;Limpeza;Lava Louça Atol Maçã 2l;R$ 9,30;Não
Atakarejo;Limpeza;Lava Roupa Bem Te Vi Flores Embalagem 500g;R$ 4,68;Não
Atakarejo;Limpeza;Lava Roupa Ekobom 1kg;R$ 5,62;Não
Atakarejo;Limpeza;Lava Roupa Em Pó Coco Cuidado Bem Te Vi 400g;R$ 4,08;Não
Atakarejo;Limpeza;Lava Roupa Em Pó Lavanda Ala 400g;R$ 4,74;Não
Atakarejo;Limpeza;Lava Roupa Em Pó Lavanda Bem Te Vi 400g;R$ 4,08;Não
Atakarejo;Limpeza;Lava Roupa Em Pó Perfume da Flores Bem Te Vi 1,6kg;R$ 15,38;Não
Atakarejo;Limpeza;Lava Roupa Em Pó Perfume da Natureza com Alecrim Bem Te Vi 400g;R$ 4,08;Não
Atakarejo;Limpeza;Lava Roupa Em Pó Perfume das Flores Bem Te Vi 400g;R$ 4,08;Não
Atakarejo;Limpeza;Lava Roupa Em Pó Super Branco Bem Te Vi 400g;R$ 4,08;Não
Atakarejo;Limpeza;Lava Roupa Liq Ekobom 5lt;R$ 32,98;Não
Atakarejo;Limpeza;Lava Roupa Liq.Brilhante 1,8l Limpeza To;R$ 21,95;Não
Atakarejo;Limpeza;Lava Roupa Líquido Action Dragão 5l;R$ 32,98;Não
Atakarejo;Limpeza;Lava Roupa Po Atol Coco 400g;R$ 3,76;Não
Atakarejo;Limpeza;Lava Roupa Pó Ala Erva Doce E Bicarbonato;R$ 4,74;Não
Atakarejo;Limpeza;Lava Roupa Pó Cuidado do Coco Ala 800g;R$ 6,80;Não
Atakarejo;Limpeza;Lava Roupa em Pó Rosa Flor Liz Ala 400g;R$ 4,74;Não
Atakarejo;Limpeza;Lava Roupas Action Dragão 3l;R$ 22,09;Não
Atakarejo;Limpeza;Lava Roupas Ala 18l Fresco;R$ 19,19;Não
Atakarejo;Limpeza;Lava Roupas Brilhante Líquido Higiene Total 1,8 Litros;R$ 21,95;Não
Atakarejo;Limpeza;Lava Roupas Desinfetante Pó Higiene Total Combate Germes e Bactérias Brilhante 400g;R$ 5,98;Não
Atakarejo;Limpeza;Lava Roupas Em Pó Coco Bem Te Vi 1,6kg;R$ 15,38;Não
Atakarejo;Limpeza;Lava Roupas Em Pó Cuidado Total Brilhante 800g;R$ 12,39;Não
Atakarejo;Limpeza;Lava Roupas Em Pó Cuidado do Coco Ala 400g;R$ 4,74;Não
Atakarejo;Limpeza;Lava Roupas Líquido 5 em 1 Lavanda Ala 5 L;R$ 51,99;Não
Atakarejo;Limpeza;Lava Roupas Líquido Ação Total Radiante 700ml;R$ 8,25;Não
Atakarejo;Limpeza;Lava Roupas Líquido Cuidado Do Coco Ala 1,8l;R$ 19,19;Não
Atakarejo;Limpeza;Lava Roupas Líquido Cuidado do Coco Ala 700ml;R$ 8,45;Não
Atakarejo;Limpeza;Lava Roupas Líquido Ekobom 1l;R$ 7,30;Não
Atakarejo;Limpeza;Lava Roupas Líquido Ekobom 3l;R$ 18,59;Não
Atakarejo;Limpeza;Lava Roupas Líquido Higiene Total Brilhante Refil 900ml;R$ 14,28;Não
Atakarejo;Limpeza;Lava Roupas Líquido Lavanda Refil Ala 700ml;R$ 8,45;Não
Atakarejo;Limpeza;Lava Roupas Líquido Limpeza Total Brilhante Refil 900ml;R$ 14,28;Não
Atakarejo;Limpeza;Lava Roupas Líquido Tixan Ypê Primavera 3l;R$ 45,38;Não
Atakarejo;Limpeza;Lava Roupas Líquido Tixan Ypê Primavera 5l;R$ 62,54;Não
Atakarejo;Limpeza;Lava Roupas Pó Concentrado Primavera Tixan Ypê 2,4kg;R$ 27,79;Não
Atakarejo;Limpeza;Lava Roupas Sabão em Pó Limpeza Total Brilhante 2,4kg;R$ 26,69;Não
Atakarejo;Limpeza;Lava Roupas em Pó Action Coco Invicto 1,6kg;R$ 13,98;Não
Atakarejo;Limpeza;Lava Roupas em Pó Limpeza Total Brilhante 800g;R$ 12,39;Não
Atakarejo;Limpeza;Lava Roupas em Pó Máxima Limpeza Embalagem Econômica Minuano 1,6kg;R$ 20,26;Não
Atakarejo;Limpeza;Lava Roupas em Pó Roupas Brancas e Coloridas Higiene Total Antibac Brilhante 2,4kg;R$ 26,69;Não
Atakarejo;Limpeza;Lava Roupas em Pó Tixan Primavera Ypê 1,6kg;R$ 17,01;Não
Atakarejo;Limpeza;Lava Roupas em Pó para Roupas Brancas e Coloridas Cuidado Total Brilhante 400g;R$ 6,12;Não
Atakarejo;Limpeza;Lava-Louças Líquido Clear Minuano Embalagem 500ml;R$ 2,68;Não
Atakarejo;Limpeza;Lava-Roupas em Pó Concentrado Primavera Tixan Ypê Pague 3,6kg Leve 4kg;R$ 41,85;Não
Atakarejo;Limpeza;Lava-roupas Pó Omo Lavagem Perfeita Caixa 400g;R$ 10,38;Não
Atakarejo;Limpeza;Limp Ekobom Campestre 500ml;R$ 3,65;Não
Atakarejo;Limpeza;Limp Esponja Ypê Multiuso Anatômica 3un;R$ 5,90;Não
Atakarejo;Limpeza;Limpa Alumínio Polial Tradicional 500ml;R$ 3,20;Não
Atakarejo;Limpeza;Limpa Fornos Diabo Verde 250g;R$ 16,20;Não
Atakarejo;Limpeza;Limpa Vidros 3 em 1 Limpol 500ml;R$ 6,49;Não
Atakarejo;Limpeza;Limpador Brilux Perfumes Lavanda Embalagem 500ml;R$ 4,98;Não
Atakarejo;Limpeza;Limpador Brilux Perfumes Magia Embalagem 500ml;R$ 4,98;Não
Atakarejo;Limpeza;Limpador Brilux Perfumes Ternura Embalagem 500ml;R$ 4,98;Não
Atakarejo;Limpeza;Limpador Desengordurante Cozinha Lavanda 20% de Desconto Veja 500ml;R$ 12,28;Não
Atakarejo;Limpeza;Limpador Diluível Fresh Lemon Ajax 500ml;R$ 7,98;Não
Atakarejo;Limpeza;Limpador Dragão Classic Embalagem 500ml;R$ 3,59;Não
Atakarejo;Limpeza;Limpador Mr. Musculo Banheiro Total Refil 400ml Oferta Especial;R$ 11,45;Não
Atakarejo;Limpeza;Limpador Multiuso Brilhux Tradicional 500ml;R$ 4,69;Não
Atakarejo;Limpeza;Limpador Multiuso Brilux 4 em 1 Limão 500ml;R$ 4,69;Não
Atakarejo;Limpeza;Limpador Multiuso Brilux Lavanda Embalagem 500ml;R$ 4,69;Não
Atakarejo;Limpeza;Limpador Multiuso Brilux Tradicional Embalagem Leve 750ml Pague 500ml;R$ 4,69;Não
Atakarejo;Limpeza;Limpador Multiuso Cremoso Laranja Cif 450ml;R$ 21,75;Não
Atakarejo;Limpeza;Limpador Multiuso Cremoso Limão Cif 250ml;R$ 12,39;Não
Atakarejo;Limpeza;Limpador Multiuso Original Gold Veja 500ml;R$ 4,44;Não
Atakarejo;Limpeza;Limpador Multiuso Perfumado Jojo Marcante E Envolvente Veja 500ml;R$ 8,68;Não
Atakarejo;Limpeza;Limpador Multiuso Power Fusion Limão Veja 500 Ml;R$ 8,68;Não
Atakarejo;Limpeza;Limpador Multiuso Qboa Lavanda com Álcool 500ml;R$ 4,10;Não
Atakarejo;Limpeza;Limpador Multiuso Qboa Maçã Verde 500ml;R$ 4,10;Não
Atakarejo;Limpeza;Limpador Multiuso Qboa Tradicional 500ml;R$ 4,10;Não
Atakarejo;Limpeza;Limpador Multiuso Tradicional 500ml Ekobom;R$ 3,65;Não
Atakarejo;Limpeza;Limpador Multiuso Veja Floral 500ml;R$ 4,44;Não
Atakarejo;Limpeza;Limpador Multiuso Veja Gold Campestre 500ml;R$ 4,44;Não
Atakarejo;Limpeza;Limpador Multiuso Veja Lavanda e Álcool 500ml;R$ 4,44;Não
Atakarejo;Limpeza;Limpador Multiuso com Álcool Ypê 500ml;R$ 5,85;Não
Atakarejo;Limpeza;Limpador Perfumado Coala Capim Limão 120ml;R$ 12,68;Não
Atakarejo;Limpeza;Limpador Perfumado Lírio do Nilo Perfumes Veja 2l;R$ 15,35;Não
Atakarejo;Limpeza;Limpador Perfumado Lírio do Nilo Veja 1l;R$ 9,48;Não
Atakarejo;Limpeza;Limpador Perfumado Orquídea Negra Radiante 500ml;R$ 5,06;Não
Atakarejo;Limpeza;Limpador Perfumado Perfumes Flores Vermelhas e Sedução Uau Inglesa Leve 2l Pague 1,6l);R$ 16,49;Não
Atakarejo;Limpeza;Limpador Perfumado Radiante Flores Tropicais 500ml;R$ 5,06;Não
Atakarejo;Limpeza;Limpador Perfumado Radiante Pétalas de Lavanda 500ml;R$ 5,06;Não
Atakarejo;Limpeza;Limpador Perfumado Tutti Frutti Coala 120ml;R$ 12,68;Não
Atakarejo;Limpeza;Limpador Perfumado Uau Flores Vermelhas Ingleza Leve 1l Pague 800ml;R$ 7,89;Não
Atakarejo;Limpeza;Limpador Perfumado Ypê 2l;R$ 22,12;Não
Atakarejo;Limpeza;Limpador Perfumado Ypê Azul Tropical 1lt;R$ 12,76;Não
Atakarejo;Limpeza;Limpador Perfumado Ypê Doce Vida 1 Litro;R$ 12,76;Não
Atakarejo;Limpeza;Limpador Perfumadolavanda da França Veja 1l;R$ 9,48;Não
Atakarejo;Limpeza;Limpador Sanol Superfícies Alecrim Pet 120ml;R$ 11,08;Não
Atakarejo;Limpeza;Limpador Uau Lavanda Conforto com 20% de Desconto 2l;R$ 16,49;Não
Atakarejo;Limpeza;Limpador Uau Perfumes Lavanda e Conforto Embalagem L1p800ml;R$ 7,89;Não
Atakarejo;Limpeza;Limpador Veja Perfumes Flores do Mediterrâneo 30% Grátis 500ml;R$ 6,36;Não
