mercado;categoria;produto;preco;produto_nos_dois
Atacadão;Biscoitos e Salgadinhos;Biscoito Coco Baiano São Benedito 300g;R$ 8,08;Não
Atacadão;Biscoitos e Salgadinhos;Biscoito Coco Tostines 160g;R$ 4,30;Sim
Atacadão;Biscoitos e Salgadinhos;Biscoito Cookie Ao Leite Lacta 80g;R$ 6,46;Não
Atacadão;Biscoitos e Salgadinhos;Biscoito Cookie Baunilha Com Chocolate Nestlé Classic 60g;R$ 3,55;Não
Atacadão;Biscoitos e Salgadinhos;Biscoito Cookie Branco Maxi Bauducco 96g;R$ 4,30;Sim
Atacadão;Biscoitos e Salgadinhos;Biscoito Cookie Chocolate Piraquê Pacote 80g;R$ 5,92;Não
Atacadão;Biscoitos e Salgadinhos;Biscoito Cookie Laka Lacta 80g;R$ 6,46;Não
Atacadão;Biscoitos e Salgadinhos;Biscoito Cookie Original Piraquê 80g;R$ 5,92;Não
Atacadão;Biscoitos e Salgadinhos;Biscoito Cookie Original Toddy Pacote 57g;R$ 3,22;Não
Atacadão;Biscoitos e Salgadinhos;Biscoito Cookies Original Bauducco 60g;R$ 3,76;Não
Atacadão;Biscoitos e Salgadinhos;Biscoito Cracker Água Tostines 200g;R$ 5,38;Não
Atacadão;Biscoitos e Salgadinhos;Biscoito Cream Cracker Bauducco 165g;R$ 2,14;Não
Atacadão;Biscoitos e Salgadinhos;Biscoito Cream Cracker Integral Marilan 365g;R$ 8,08;Sim
Atacadão;Biscoitos e Salgadinhos;Biscoito Cream Cracker Integral Pilar 420g;R$ 7,45;Sim
Atacadão;Biscoitos e Salgadinhos;Biscoito Cream Cracker Integral Vitarella 367,5g;R$ 7,54;Sim
Atacadão;Biscoitos e Salgadinhos;Biscoito Cream Cracker Legítimo Fortaleza 350g;R$ 5,13;Não
Atacadão;Biscoitos e Salgadinhos;Biscoito Cream Cracker Manteiga Pilar 350g;R$ 4,05;Sim
Atacadão;Biscoitos e Salgadinhos;Biscoito Cream Cracker Pão Assado Crocks Vitarella 350g;R$ 7,00;Sim
Atacadão;Biscoitos e Salgadinhos;Biscoito Cream Cracker Tradicional Vitarella 350g;R$ 4,30;Sim
Atacadão;Biscoitos e Salgadinhos;Biscoito Cream Craker Rancheiro 300g;R$ 3,98;Sim
Atacadão;Biscoitos e Salgadinhos;Biscoito Delicitá Original Vitarella 350g;R$ 6,25;Sim
Atacadão;Biscoitos e Salgadinhos;Biscoito Distração de Chocolate Marilan 320g;R$ 6,79;Não
Atacadão;Biscoitos e Salgadinhos;Biscoito Doce Delicitá Cristal Vitarella 414g;R$ 9,16;Sim
Atacadão;Biscoitos e Salgadinhos;Biscoito Doce Integral Lev Granola e Mel 150g;R$ 7,54;Não
Atacadão;Biscoitos e Salgadinhos;Biscoito Doce Integral Mel e Cacau Belvita 225g com 9un;R$ 15,64;Não
Atacadão;Biscoitos e Salgadinhos;Biscoito Doce Palito São Benedito 300g;R$ 7,00;Não
Atacadão;Biscoitos e Salgadinhos;Biscoito Doce Piraquê Goiabinha Embalagem 25g;R$ 2,14;Não
Atacadão;Biscoitos e Salgadinhos;Biscoito Doce Recheado Oreo Original Wandinha 36g;R$ 2,14;Não
Atacadão;Biscoitos e Salgadinhos;Biscoito Doce Recheado Rancheiro Chocolate 90g;R$ 1,93;Não
Atacadão;Biscoitos e Salgadinhos;Biscoito Doce Santa Edwiges Peppa Pig Sabor Leite 100g;R$ 2,14;Não
Atacadão;Biscoitos e Salgadinhos;Biscoito Doce São Benedito Canela Embalagem 400g;R$ 7,54;Não
Atacadão;Biscoitos e Salgadinhos;Biscoito Doce São Benedito Coco Americano Embalagem 400g;R$ 7,33;Não
Atacadão;Biscoitos e Salgadinhos;Biscoito Formato Tortuguita Chocolate 90g;R$ 2,36;Não
Atacadão;Biscoitos e Salgadinhos;Biscoito Formato Tortuguita Morango 90g;R$ 2,36;Sim
Atacadão;Biscoitos e Salgadinhos;Biscoito Garoto Choco Biscuit Ao Leite 78g;R$ 6,46;Não
Atacadão;Biscoitos e Salgadinhos;Biscoito Integral Brandini Salt Plus 360g;R$ 6,46;Não
Atacadão;Biscoitos e Salgadinhos;Biscoito Integral Limão e Cereais Nesfit 160g;R$ 4,84;Não
Atacadão;Biscoitos e Salgadinhos;Biscoito Integral Mel e Cacau Belvita 75g com 3un;R$ 5,38;Não
Atacadão;Biscoitos e Salgadinhos;Biscoito Integral Tradicional Leve Mais e Pague Menos Club Social 288g;R$ 9,16;Não
Atacadão;Biscoitos e Salgadinhos;Biscoito Integral Vitarella Delicitá 367,5g;R$ 7,54;Sim
Atacadão;Biscoitos e Salgadinhos;Biscoito Laranja e Cenoura Nesfit 160g;R$ 4,84;Não
Atacadão;Biscoitos e Salgadinhos;Biscoito Leite Maltado Cobertura de Chocolate Black Piraquê 80g;R$ 3,87;Não
Atacadão;Biscoitos e Salgadinhos;Biscoito Leite Maltado Recheio de Doce de Leite Piraquê 85g;R$ 3,76;Não
Atacadão;Biscoitos e Salgadinhos;Biscoito Leite Treloso Clubinho Vitarella 130g;R$ 4,52;Sim
Atacadão;Biscoitos e Salgadinhos;Biscoito Maizena Bauducco 170g;R$ 4,63;Não
Atacadão;Biscoitos e Salgadinhos;Biscoito Maizena Integral Marilan 350g;R$ 9,61;Não
Atacadão;Biscoitos e Salgadinhos;Biscoito Maizena Marilan 350g;R$ 5,37;Sim
Atacadão;Biscoitos e Salgadinhos;Biscoito Maizena Pilar 307g Tradicional;R$ 5,06;Sim
Atacadão;Biscoitos e Salgadinhos;Biscoito Maizena Tostines 200g;R$ 4,84;Não
Atacadão;Biscoitos e Salgadinhos;Biscoito Maizena Tradicional Vitarella 350g;R$ 5,28;Sim
Atacadão;Biscoitos e Salgadinhos;Biscoito Maria Chocolate Pilar 307g;R$ 6,46;Não
Atacadão;Biscoitos e Salgadinhos;Biscoito Maria Maria 350g;R$ 5,92;Sim
Atacadão;Biscoitos e Salgadinhos;Biscoito Maria Sabor Chocolate Fortaleza 350g;R$ 8,53;Não
Atacadão;Biscoitos e Salgadinhos;Biscoito Maria Sabor Leite Fortaleza 350g;R$ 7,87;Não
Atacadão;Biscoitos e Salgadinhos;Biscoito Maria Tradicional Fortaleza 350g;R$ 7,87;Sim
Atacadão;Biscoitos e Salgadinhos;Biscoito Maria Tradicional Vitarella 350g;R$ 5,28;Sim
Atacadão;Biscoitos e Salgadinhos;Biscoito Marilan Cookies Chocolate 80g;R$ 5,38;Não
Atacadão;Biscoitos e Salgadinhos;Biscoito Marilan Cream Cracker Especial 350g;R$ 4,30;Sim
Atacadão;Biscoitos e Salgadinhos;Biscoito Marilan Integral Pit Stop Integral 228g;R$ 8,62;Não
Atacadão;Biscoitos e Salgadinhos;Biscoito Marilan Salgadinho Sortido Tradicional 400g;R$ 8,62;Não
Atacadão;Biscoitos e Salgadinhos;Biscoito Marilan Wafer Chocolate 80g;R$ 2,14;Sim
Atacadão;Biscoitos e Salgadinhos;Biscoito Marilan Wafer Morango 80g;R$ 2,14;Sim
Atacadão;Biscoitos e Salgadinhos;Biscoito Maçã e Canela Tostines 160g;R$ 4,30;Não
Atacadão;Biscoitos e Salgadinhos;Biscoito Mini Maizena Marilan 30g;R$ 1,50;Não
Atacadão;Biscoitos e Salgadinhos;Biscoito Mix de Queijo Club Social 141g;R$ 6,46;Não
Atacadão;Biscoitos e Salgadinhos;Biscoito Morango e Cereais Nestlé Nesfit 160g;R$ 4,84;Sim
Atacadão;Biscoitos e Salgadinhos;Biscoito Nestlé Cacau e Cereais Nesfit 160g;R$ 4,84;Sim
Atacadão;Biscoitos e Salgadinhos;Biscoito Newafer Morango Piraquê 100g;R$ 4,30;Não
Atacadão;Biscoitos e Salgadinhos;Biscoito Newafer Sabor Chocolate Piraquê 100g;R$ 4,30;Sim
Atacadão;Biscoitos e Salgadinhos;Biscoito Newafer Sabor Limão Piraquê 100g;R$ 4,30;Sim
Atacadão;Biscoitos e Salgadinhos;Biscoito Original Brandini Salt Plus 360g;R$ 6,46;Não
Atacadão;Biscoitos e Salgadinhos;Biscoito Original Leve Mais e Pague Menos Club Social 288g;R$ 9,16;Sim
Atacadão;Biscoitos e Salgadinhos;Biscoito Original Sol Hits 80g;R$ 2,68;Não
Atacadão;Biscoitos e Salgadinhos;Biscoito Piraquê Salgado 138g Original;R$ 4,30;Sim
Atacadão;Biscoitos e Salgadinhos;Biscoito Pit Stop Original Pacote Marilan 137g;R$ 3,22;Não
Atacadão;Biscoitos e Salgadinhos;Biscoito Polvilho Amavita 100g;R$ 5,38;Não
Atacadão;Biscoitos e Salgadinhos;Biscoito Presunto Sol Hits 80g;R$ 2,68;Sim
Atacadão;Biscoitos e Salgadinhos;Biscoito Queijo Sol Hits 80g;R$ 2,68;Sim
Atacadão;Biscoitos e Salgadinhos;Biscoito Rancheiro Chocolate E Baunilha 90g Zero Lactose;R$ 1,93;Não
Atacadão;Biscoitos e Salgadinhos;Biscoito Recheadinho Chocolate Bauducco 104g;R$ 4,30;Não
Atacadão;Biscoitos e Salgadinhos;Biscoito Recheado Bauny Marilan 80g;R$ 1,06;Sim
Atacadão;Biscoitos e Salgadinhos;Biscoito Recheado Chocolate Amori Richester 35,6g;R$ 1,28;Sim
Atacadão;Biscoitos e Salgadinhos;Biscoito Recheado Chocolate Bono Nestle 90g;R$ 3,12;Sim
Atacadão;Biscoitos e Salgadinhos;Biscoito Recheado Chocolate Toddy 100g;R$ 1,93;Não
Atacadão;Biscoitos e Salgadinhos;Biscoito Recheado Chocolate Wandinha Embalagem Econômica Multipack Oreo 270g;R$ 10,69;Não
Atacadão;Biscoitos e Salgadinhos;Biscoito Recheado Doce de Leite Bono Nestle 90g;R$ 3,12;Sim
Atacadão;Biscoitos e Salgadinhos;Biscoito Recheado Escureto Richester 35,6g;R$ 1,28;Sim
Atacadão;Biscoitos e Salgadinhos;Biscoito Recheado Goiabinha Bauducco 112g;R$ 4,30;Sim
Atacadão;Biscoitos e Salgadinhos;Biscoito Recheado Limao Bono Nestle 90g;R$ 3,12;Não
Atacadão;Biscoitos e Salgadinhos;Biscoito Recheado Maltado Sabor Chocolate Maltado Piraquê 85g;R$ 3,76;Não
Atacadão;Biscoitos e Salgadinhos;Biscoito Recheado Milkshake de Morango Multipack Oreo 144g;R$ 7,54;Não
Atacadão;Biscoitos e Salgadinhos;Biscoito Recheado Mini Oreo 35g;R$ 3,01;Sim
Atacadão;Biscoitos e Salgadinhos;Biscoito Recheado Morango Toddy 100g;R$ 1,93;Não
Atacadão;Biscoitos e Salgadinhos;Biscoito Recheado Nescau 140g;R$ 5,38;Não
Atacadão;Biscoitos e Salgadinhos;Biscoito Recheado Original Oreo 144g;R$ 7,54;Sim
Atacadão;Biscoitos e Salgadinhos;Biscoito Recheado Original Wandinha Multipack Oreo 270g;R$ 10,69;Não
Atacadão;Biscoitos e Salgadinhos;Biscoito Recheado Prestígio 140g;R$ 5,38;Não
Atacadão;Biscoitos e Salgadinhos;Biscoito Recheado Pretty Piraquê 76g;R$ 2,90;Não
Atacadão;Biscoitos e Salgadinhos;Biscoito Recheado Queijo, Tomate e Manjericão Club Social 106g;R$ 6,46;Não
Atacadão;Biscoitos e Salgadinhos;Biscoito Recheado Requeijão Club Social 106gr;R$ 6,46;Não
Atacadão;Biscoitos e Salgadinhos;Biscoito Recheado Sabor Chocolate Marilan 80g;R$ 1,06;Não
Atacadão;Biscoitos e Salgadinhos;Biscoito Recheado Sabor Chocolate Wandinha Multipack Oreo 144g;R$ 7,54;Não
Atacadão;Biscoitos e Salgadinhos;Biscoito Recheado Sabor Chocolate Wandinha Oreo 90g;R$ 4,30;Não
Atacadão;Biscoitos e Salgadinhos;Biscoito Recheado Sabor Chocolate com Morango Treloso Vitarella 120g;R$ 1,89;Sim
Atacadão;Biscoitos e Salgadinhos;Biscoito Recheado Sabor Flocos Vitarella 120g;R$ 1,89;Sim
Atacadão;Biscoitos e Salgadinhos;Biscoito Recheado Sabor Limão Piraquê 76g;R$ 2,90;Sim
Atacadão;Biscoitos e Salgadinhos;Biscoito Recheado Sabor Morango E Caramelo Rancheiro 90g;R$ 1,93;Não
Atacadão;Biscoitos e Salgadinhos;Biscoito Recheado Sabor Morango Marilan 80g;R$ 1,06;Não
Atacadão;Biscoitos e Salgadinhos;Biscoito Recheado Sabor Morango Piraquê 76g;R$ 2,90;Não
Atacadão;Biscoitos e Salgadinhos;Biscoito Recheado Sabor de Chocolate Piraquê 76g;R$ 2,90;Sim
Atacadão;Biscoitos e Salgadinhos;Biscoito Recheado Toddy 100g Baunilha;R$ 1,93;Não
Atacadão;Biscoitos e Salgadinhos;Biscoito Recheado Tub In Morango Montevergine Embalagem 48g;R$ 2,47;Sim
Atacadão;Biscoitos e Salgadinhos;Biscoito Recheado com Morango Amori Richester 35,6g;R$ 1,28;Sim
Atacadão;Biscoitos e Salgadinhos;Biscoito Recheado de Brigadeiro Treloso Vitarella 120g;R$ 1,89;Sim
Atacadão;Biscoitos e Salgadinhos;Biscoito Recheado de Chocolate Passatempo 130g;R$ 3,76;Sim
Atacadão;Biscoitos e Salgadinhos;Biscoito Recheado de Chocolate Quadrado Treloso Clubinho Vitarella 130g;R$ 2,90;Não
Atacadão;Biscoitos e Salgadinhos;Biscoito Recheado de Morango Passatempo 130g;R$ 3,76;Sim
Atacadão;Biscoitos e Salgadinhos;Biscoito Recheio Bem-Casado Treloso Vitarella 120g;R$ 1,89;Sim
Atacadão;Biscoitos e Salgadinhos;Biscoito Recheio Chocolate Marilan Pit Stop 98g com 4un;R$ 4,63;Sim
Atacadão;Biscoitos e Salgadinhos;Biscoito Recheio Chocolate Negresco 90g;R$ 3,12;Sim
Atacadão;Biscoitos e Salgadinhos;Biscoito Recheio Sabor Morango Bono 90g;R$ 3,12;Sim
Atacadão;Biscoitos e Salgadinhos;Biscoito Recheio Supreme Chocolate com Creme de Avelã Piraquê 80g;R$ 4,30;Sim
Atacadão;Biscoitos e Salgadinhos;Biscoito Recheio de Morango Richester Amori 125g;R$ 2,90;Sim
Atacadão;Biscoitos e Salgadinhos;Biscoito Richester Cookie Baunilha com Gotas de Chocolate 60g;R$ 5,38;Não
Atacadão;Biscoitos e Salgadinhos;Biscoito Roladinho Goiabinha Piraquê 75g;R$ 4,30;Não
Atacadão;Biscoitos e Salgadinhos;Biscoito Rosca de Chocolate Micos 300g;R$ 3,22;Não
Atacadão;Biscoitos e Salgadinhos;Biscoito Rosquinha Coco Vitarella 300g;R$ 6,14;Não
Atacadão;Biscoitos e Salgadinhos;Biscoito Rosquinha Integral Marilan 300g;R$ 8,62;Não
Atacadão;Biscoitos e Salgadinhos;Biscoito Rosquinha Leite Vitarella 300g;R$ 6,14;Não
Atacadão;Biscoitos e Salgadinhos;Biscoito Rosquinha Recheada Sabor Chocolate Rancheiro 90g;R$ 1,93;Não
Atacadão;Biscoitos e Salgadinhos;Biscoito Rosquinha Tradicional Chocolate Marilan 300g;R$ 7,45;Sim
Atacadão;Biscoitos e Salgadinhos;Biscoito Sabor Leite Maltado Black Recheio Baunilha Piraquê 85g;R$ 3,76;Não
Atacadão;Biscoitos e Salgadinhos;Biscoito Salgado Club Social Presunto Multipack 141g;R$ 6,46;Sim
Atacadão;Biscoitos e Salgadinhos;Biscoito Salgado Cracker Mini Fortaleza Pacote 400g;R$ 9,61;Não
Atacadão;Biscoitos e Salgadinhos;Biscoito Salgado Delicitá Queijo 138g;R$ 3,98;Sim
Atacadão;Biscoitos e Salgadinhos;Biscoito Salgado Integral Piraquê 138g com 6un de 23g;R$ 4,30;Não
Atacadão;Biscoitos e Salgadinhos;Biscoito Salgado Salgadinho Piraquê 100g;R$ 5,92;Não
Atacadão;Biscoitos e Salgadinhos;Biscoito Santa Edwiges Galinha Pintadinha Leite 100g;R$ 2,14;Não
Atacadão;Biscoitos e Salgadinhos;Biscoito Sequilho Porto Alegre Baunilha 100g;R$ 4,30;Não
Atacadão;Biscoitos e Salgadinhos;Biscoito Sequilho Porto Alegre Leite Condensado 100g;R$ 4,30;Não
Atacadão;Biscoitos e Salgadinhos;Biscoito Sequilho Porto Alegre Tradicional 100g;R$ 4,30;Não
Atacadão;Biscoitos e Salgadinhos;Biscoito Speculos Caramelizado Bauducco 84g;R$ 3,33;Não
Atacadão;Biscoitos e Salgadinhos;Biscoito Supreme Chocolate Branco E Geleia de Limão Siciliano Piraquê 80g;R$ 4,30;Sim
Atacadão;Biscoitos e Salgadinhos;Biscoito Supreme Chocolate Branco E Geleia de Maçã com Canela Piraquê 80g;R$ 4,30;Não
Atacadão;Biscoitos e Salgadinhos;Biscoito Teens Bauny 30g;R$ 2,14;Não
Atacadão;Biscoitos e Salgadinhos;Biscoito Toddy Cookies Malhado Gotas Branco/Preto 57g;R$ 3,22;Não
Atacadão;Biscoitos e Salgadinhos;Biscoito Tortinha Morango Vitarella 140g;R$ 3,55;Não
Atacadão;Biscoitos e Salgadinhos;Biscoito Tortinha Sabor Chocolate Marilan 140g;R$ 5,38;Sim
Atacadão;Biscoitos e Salgadinhos;Biscoito Tortinhas de Chocolate Vitarella 140g;R$ 3,55;Sim
Atacadão;Biscoitos e Salgadinhos;Biscoito Tortinhas de Limão Vitarella 140g;R$ 3,55;Sim
Atacadão;Biscoitos e Salgadinhos;Biscoito Tortuguita Arcor Morango 516g;R$ 15,01;Não
Atacadão;Biscoitos e Salgadinhos;Biscoito Trakinas Chocolate 126g;R$ 3,22;Sim
Atacadão;Biscoitos e Salgadinhos;Biscoito Triunfo Salpet Tradicional 100g;R$ 3,01;Não
Atacadão;Biscoitos e Salgadinhos;Biscoito Wafer Limão Marilan 80g;R$ 2,14;Sim
Atacadão;Biscoitos e Salgadinhos;Biscoito Wafer Limão Rancheiro Pacote 78g;R$ 1,60;Sim
Atacadão;Biscoitos e Salgadinhos;Biscoito Wafer Look Atrevidos Sabor Chocolate Branco Itamaraty 55g;R$ 3,01;Não
Atacadão;Biscoitos e Salgadinhos;Biscoito Wafer Look Recheado Floresta Negra Itamaraty 55g;R$ 3,01;Não
Atacadão;Biscoitos e Salgadinhos;Biscoito Wafer Look Recheado de Cookies & Cream Itamaraty 55g;R$ 3,01;Não
Atacadão;Biscoitos e Salgadinhos;Biscoito Wafer Look Sabor Brigadeiro Itamaraty 55g;R$ 3,01;Não
Atacadão;Biscoitos e Salgadinhos;Biscoito Wafer Marilan Brigadeiro 80g;R$ 2,14;Não
Atacadão;Biscoitos e Salgadinhos;Biscoito Wafer Maxi Pistache Bauducco 104g;R$ 3,76;Não
Atacadão;Biscoitos e Salgadinhos;Biscoito Wafer Maxi Sabor Chocolate Bauducco 104g;R$ 3,76;Não
Atacadão;Biscoitos e Salgadinhos;Biscoito Wafer Montevergine Napolitano 48g Tub In;R$ 2,47;Não
Atacadão;Biscoitos e Salgadinhos;Biscoito Wafer Morango Rancheiro 78g;R$ 1,60;Sim
Atacadão;Biscoitos e Salgadinhos;Biscoito Wafer Rancheiro Baunilha 78g;R$ 1,60;Sim
Atacadão;Biscoitos e Salgadinhos;Biscoito Wafer Sabor Brigadeiro Bauducco 70g;R$ 1,60;Sim
Atacadão;Biscoitos e Salgadinhos;Biscoito Wafer Sabor Brigadeiro Vitarella 80g;R$ 1,17;Sim
Atacadão;Biscoitos e Salgadinhos;Biscoito Wafer Sabor Limão Vitarella 80g;R$ 1,17;Sim
Atacadão;Biscoitos e Salgadinhos;Biscoito Wafer Sabor Morango Bauducco 70g;R$ 1,60;Sim
Atacadão;Biscoitos e Salgadinhos;Biscoito Wafer Sabor Morango Vitarella 80g;R$ 1,17;Sim
Atacadão;Biscoitos e Salgadinhos;Biscoito Wafer com Recheio de Chocolate Bauducco 70g;R$ 1,60;Sim
Atacadão;Biscoitos e Salgadinhos;Biscoito Wafer de Chocolate Treloso Vitarella 35g;R$ 1,17;Sim
Atacadão;Biscoitos e Salgadinhos;Biscoito Wafer de Morango Treloso Vitarella 35g;R$ 1,17;Sim
Atacadão;Biscoitos e Salgadinhos;Biscoito Waffer de Chocolate Rancheiro 78g;R$ 1,60;Sim
Atacadão;Biscoitos e Salgadinhos;Biscoito com Recheio Sabor Morango Treloso Vitarella 120g;R$ 1,89;Sim
Atacadão;Biscoitos e Salgadinhos;Biscoito de Chocolate Bauducco 335g;R$ 8,52;Sim
Atacadão;Biscoitos e Salgadinhos;Biscoito de Chocolate Calipso 130g;R$ 9,16;Não
Atacadão;Biscoitos e Salgadinhos;Biscoito de Chocolate Recheado de Baunilha Escureto Richester 125g;R$ 2,90;Sim
Atacadão;Biscoitos e Salgadinhos;Biscoito de Chocolate Recheio Baunilha Negresco 90g;R$ 3,12;Sim
Atacadão;Biscoitos e Salgadinhos;Biscoito de Chocolate Recheio Chocolate Treloso Vitarella 120g;R$ 1,89;Sim
Atacadão;Biscoitos e Salgadinhos;Biscoito de Chocolate com Recheio de Chocolate Richester Amori 125g;R$ 2,90;Sim
Atacadão;Biscoitos e Salgadinhos;Biscoito de Chocolate com Recheio de Morango Bauducco 108g;R$ 2,68;Não
Atacadão;Biscoitos e Salgadinhos;Biscoito de Coco Marilan 350g;R$ 5,37;Sim
Atacadão;Biscoitos e Salgadinhos;Biscoito de Leite Maltado Black Piraquê 132g;R$ 5,38;Não
Atacadão;Biscoitos e Salgadinhos;Biscoito de Leite Maria Vitarella 350g;R$ 5,28;Sim
Atacadão;Biscoitos e Salgadinhos;Biscoito de Leite Marilan 350g;R$ 5,37;Sim
Atacadão;Biscoitos e Salgadinhos;Biscoito de Leite Richester Animados Zoo Cobertura Sabor Chocolate com 40g;R$ 4,09;Sim
Atacadão;Biscoitos e Salgadinhos;Biscoito de Maisena Vegano Natural Life 112g;R$ 8,53;Não
Atacadão;Biscoitos e Salgadinhos;Biscoito de Maizena Sabor Chocolate Fortaleza 350g;R$ 8,53;Sim
Atacadão;Biscoitos e Salgadinhos;Biscoito de Maizena Sabor Chocolate Vitarella 350g;R$ 5,71;Sim
Atacadão;Biscoitos e Salgadinhos;Biscoito de Maizena Sabor Leite Fortaleza 350g;R$ 7,87;Não
Atacadão;Biscoitos e Salgadinhos;Biscoito de Maizena Sabor Leite Vitarella 350g;R$ 5,28;Sim
Atacadão;Biscoitos e Salgadinhos;Biscoito de Maizena Tradicional Fortaleza 350g;R$ 7,87;Sim
Atacadão;Biscoitos e Salgadinhos;Biscoito de Manteiga Marilan 350g;R$ 5,37;Sim
Atacadão;Biscoitos e Salgadinhos;Biscoito de Palitos Ao Leite Cory 68g;R$ 4,30;Não
Atacadão;Biscoitos e Salgadinhos;Biscoito de Polvilho Amavita 180g;R$ 8,08;Não
Atacadão;Biscoitos e Salgadinhos;Biscoito de Polvilho Sabor Queijo Amavita 70g;R$ 4,09;Não
Atacadão;Biscoitos e Salgadinhos;Biscoito Água Tradicional Vitarella 350g;R$ 6,46;Sim
Atacadão;Biscoitos e Salgadinhos;Biscoito Água com Gergelim Piraquê Pacote 215g;R$ 7,00;Sim
Atacadão;Biscoitos e Salgadinhos;Biscoito Água e Sal Tradicional Vitarella 350g;R$ 4,30;Não
Atacadão;Biscoitos e Salgadinhos;Biscoitos Cookies Amori Sabor Chocolate com Gotas Chocolate Richester 80g;R$ 5,38;Não
Atacadão;Biscoitos e Salgadinhos;Bolacha Integral São Francisco 350g;R$ 6,85;Não
Atacadão;Biscoitos e Salgadinhos;Bolacha Manteiga do Sertão São Francisco 250g;R$ 6,64;Não
Atacadão;Biscoitos e Salgadinhos;Bolacha com Recheio Sabor Morango Negresco 90g;R$ 3,12;Sim
Atacadão;Biscoitos e Salgadinhos;Castanha Caju Marata Torrada e Salgada 50g;R$ 7,54;Não
Atacadão;Biscoitos e Salgadinhos;Castanha de Caju Dunorte 150g;R$ 21,49;Não
Atacadão;Biscoitos e Salgadinhos;Castanha de Caju Marata 50g;R$ 7,54;Não
Atacadão;Biscoitos e Salgadinhos;Castanha de Cajú Cajúmil 30g;R$ 3,76;Não
Atacadão;Biscoitos e Salgadinhos;Castanha de Cajú Torrada e Salgada La Violetera 100gr;R$ 25,38;Não
Atacadão;Biscoitos e Salgadinhos;Castanhas de Cajú W320 Dunorte Natural 150g;R$ 17,17;Não
Atacadão;Biscoitos e Salgadinhos;Choco Biscuit Meio Amargo Bauducco 80g;R$ 9,61;Sim
Atacadão;Biscoitos e Salgadinhos;Chocolate Wafer Lacta Sonho de Valsa Pacote 25g;R$ 2,36;Sim
Atacadão;Biscoitos e Salgadinhos;Chocotrio Sabor Pasta Amendoim Nestlé 90g;R$ 9,70;Não
Atacadão;Biscoitos e Salgadinhos;Cookie Bauducco 100g Original;R$ 4,30;Não
Atacadão;Biscoitos e Salgadinhos;Cookie Gotas de Chocolate Nestlé Classic 60g;R$ 3,55;Sim
Atacadão;Biscoitos e Salgadinhos;Cookie Integral Lev Cacau e Cereais 80g;R$ 5,38;Não
Atacadão;Biscoitos e Salgadinhos;Cookie Integral Lev Granola e Mel 80g;R$ 5,38;Não
Atacadão;Biscoitos e Salgadinhos;Cookie Marilan Chocolate Embalagem 40g;R$ 3,44;Não
Atacadão;Biscoitos e Salgadinhos;Cookie Marilan Original 80g;R$ 5,38;Não
Atacadão;Biscoitos e Salgadinhos;Cookie Rancheiro Gotas de Chocolate Embalagem 60g;R$ 2,47;Não
Atacadão;Biscoitos e Salgadinhos;Cookie Santa Edwiges Butter Gotas de Chocolate 90g;R$ 3,55;Não
Atacadão;Biscoitos e Salgadinhos;Cookie com Gotas de Chocolate Branco Galak 60g;R$ 3,55;Não
Atacadão;Biscoitos e Salgadinhos;Cookies Bauducco Chocolate Embalagem 60g;R$ 3,76;Sim
Atacadão;Biscoitos e Salgadinhos;Cookies Bauducco Fini Tubes P.Ling. 96g;R$ 4,30;Não
Atacadão;Biscoitos e Salgadinhos;Cookies Marilan Original com Gotas de Chocolate Embalagem 40g;R$ 3,44;Não
Atacadão;Biscoitos e Salgadinhos;Cookies Maxi Chocolate Bauducco 96g;R$ 4,30;Não
Atacadão;Biscoitos e Salgadinhos;Cookies de Chocolate com Gotas de Chocolate Bauducco 100g;R$ 4,30;Não
Atacadão;Biscoitos e Salgadinhos;Cream Cracker Vitarella Tostadinha 350g;R$ 4,30;Sim
Atacadão;Biscoitos e Salgadinhos;Mini Biscoito de Arroz Integral Sabor Pimenta Camil 150g;R$ 8,08;Sim
Atacadão;Biscoitos e Salgadinhos;Mix Castanha e Uva Passas Cajumil Embalagem 40g;R$ 2,14;Não
Atacadão;Biscoitos e Salgadinhos;Mix Nuts Maratá 50g;R$ 3,98;Não
Atacadão;Biscoitos e Salgadinhos;Nozes sem Casca Dunorte 110g;R$ 16,09;Não
Atacadão;Biscoitos e Salgadinhos;Pack Biscoito Original Vitarella Delicitá Pacote 138g 6 Unidades;R$ 3,98;Sim
Atacadão;Biscoitos e Salgadinhos;Pacote Biscoito Pão Na Chapa Pit Stop 6un Marilan 137g;R$ 3,22;Sim
Atacadão;Biscoitos e Salgadinhos;Pacote de Biscoitos Original Pit Stop Marilan com 10un;R$ 8,62;Não
Atacadão;Biscoitos e Salgadinhos;Pipoca Doce Ok 100g;R$ 2,68;Não
Atacadão;Biscoitos e Salgadinhos;Pipoca Doce Ok Embalagem 40g;R$ 1,60;Sim
Atacadão;Biscoitos e Salgadinhos;Pipoca para micro-ondas sabor presunto defumado Yoki 95g Netflix;R$ 8,62;Não
Atacadão;Biscoitos e Salgadinhos;Pistache Marata C/ Casca Torrado e Salgado 50g;R$ 8,62;Não
Atacadão;Biscoitos e Salgadinhos;Pistache com Casca Dunorte Embalagem 100 G;R$ 17,17;Não
Atacadão;Biscoitos e Salgadinhos;Rosca de Coco Micos 500g;R$ 7,33;Sim
Atacadão;Biscoitos e Salgadinhos;Rosquinha Micos Sabor Coco 300g;R$ 3,22;Sim
Atacadão;Biscoitos e Salgadinhos;Rosquinha Rancheiro Coco 300g;R$ 4,09;Sim
Atacadão;Biscoitos e Salgadinhos;Rosquinha Recheada de Orango Rancheiro 90g;R$ 1,93;Sim
Atacadão;Biscoitos e Salgadinhos;Rosquinha Tradicional Sabor Coco Marilan 300g;R$ 6,79;Sim
Atacadão;Biscoitos e Salgadinhos;Rosquinha de Chocolate Rancheiro 300g;R$ 4,09;Sim
Atacadão;Biscoitos e Salgadinhos;Rosquinha de Chocolate Vitarella 300g;R$ 6,14;Não
Atacadão;Biscoitos e Salgadinhos;Rosquinhas de Leite Micos 300g;R$ 3,22;Sim
Atacadão;Biscoitos e Salgadinhos;Salgadinho De Milho Assado Sabor Churrasco Mikão 41g;R$ 1,50;Sim
Atacadão;Biscoitos e Salgadinhos;Salgadinho De Milho Assado Sabor Requeijão Mikão 41g;R$ 1,50;Não
Atacadão;Biscoitos e Salgadinhos;Salgadinho De Milho Assado sabor Presunto Mikão 41g;R$ 1,50;Sim
Atacadão;Biscoitos e Salgadinhos;Salgadinho Lua Parmesão Elma Chips Cheetos 35g;R$ 3,76;Sim
Atacadão;Biscoitos e Salgadinhos;Salgadinho Maratá Sabor Requeijão Cremoso 45g;R$ 1,06;Não
Atacadão;Biscoitos e Salgadinhos;Salgadinho Original Sabor Peito de Peru com Requeijão Crocantíssimo 40g;R$ 3,22;Não
Atacadão;Biscoitos e Salgadinhos;Salgadinho Original Sabor Queijo & Cebola Crocantissímo 40g;R$ 3,22;Não
Atacadão;Biscoitos e Salgadinhos;Salgadinho Sabor Pimenta Mexicana Torcida 60g;R$ 2,36;Não
Atacadão;Biscoitos e Salgadinhos;Salgadinho Tradicional Crony 17g;R$ 2,14;Não
Atacadão;Biscoitos e Salgadinhos;Salgadinho de Milho Sabor Bacon Pingo D'ouro Elma Chips 160g;R$ 9,70;Não
Atacadão;Biscoitos e Salgadinhos;Salgadinho de Milho Sabor Cebola Mikão 41g;R$ 1,50;Sim
Atacadão;Biscoitos e Salgadinhos;Salgadinho de Milho Sabor Cebola Torcida 60g;R$ 2,36;Não
Atacadão;Biscoitos e Salgadinhos;Salgadinho de Milho Sabor Churrasco Torcida 60g;R$ 2,36;Não
Atacadão;Biscoitos e Salgadinhos;Salgadinho de Milho Sabor Presunto Marata;R$ 1,06;Não
Atacadão;Biscoitos e Salgadinhos;Salgadinho de Milho Sabor Queijo Nacho Doritos 120g;R$ 15,01;Não
Atacadão;Biscoitos e Salgadinhos;Salgadinho de Milho Sabor Queijo Nacho Doritos 32g;R$ 4,84;Sim
Atacadão;Biscoitos e Salgadinhos;Salgadinho de Milho Sabor Queijo Nacho Doritos 75g;R$ 7,54;Sim
Atacadão;Biscoitos e Salgadinhos;Salgadinho de Milho Sabor Queijo Parmesão Cheetos Lua Elma Chips 143g;R$ 13,93;Não
Atacadão;Biscoitos e Salgadinhos;Salgadinho de Milho Sabor Queijo Torcida 35g;R$ 1,71;Não
Atacadão;Frios e Laticínios;Banha Pamplona 1 kg;R$ 18,25;Não
Atacadão;Frios e Laticínios;Banha Refinada Aurora 1kg;R$ 17,17;Não
Atacadão;Frios e Laticínios;Capeletti 4 Queijos Mezzani 1kg;R$ 22,57;Não
Atacadão;Frios e Laticínios;Capeletti Mezzani Carne Embalagem 1kg;R$ 22,57;Não
Atacadão;Frios e Laticínios;Capeletti de Frango Mezzani 1kg;R$ 22,57;Não
Atacadão;Frios e Laticínios;Chantilly Gran Finale Fleischmann 1l;R$ 17,17;Sim
Atacadão;Frios e Laticínios;Chantilly Mix Amelia 1l;R$ 21,49;Sim
Atacadão;Frios e Laticínios;Chantilly Mix Amelia 200ml;R$ 5,28;Não
Atacadão;Frios e Laticínios;Cream Cheese Ipanema Embalagem 400g;R$ 23,65;Não
Atacadão;Frios e Laticínios;Cream Cheese Tradicional Catupiry 1,2kg;R$ 57,13;Não
Atacadão;Frios e Laticínios;Creme Hidratante Elseve Liso Dos Sonhos Aha+Queratina 300gr;R$ 26,89;Sim
Atacadão;Frios e Laticínios;Creme Leite Nestlé 300g;R$ 9,92;Não
